link,abstract
/doi/10.1287/isre.1030.0016," Embedded relationships with customers have been key in generating repeat business and economic advantage, especially in business-to-business settings. Such relationships are typically maintained through interpersonal interactions between customers and their providers. Lately, however, firms have been seeking to make their service operations more scalable by offering customers access to Internet-based, self-serve technology. This raises questions about the implications of inserting self-serve technology into embedded relationships. Recent research on the role of information technology (IT) within interfirm network relations suggests that relationships and the use of IT are complementary. However, most of this research focuses on the organizational level and fails to consider the instantiation of these interfirm relations by the actions and interactions of individual actors (e.g., customers and salespeople) representing their respective firms. In this paper, we explore the implications of using IT within interfirm relations through an analysis of customers’ and sales representatives’ (reps) work activities and interpersonal relationships. We apply a practice perspective that highlights how macrolevel phenomena such as interfirm relations are created and recreated through the microlevel actions taken by firm members. This analysis reveals that managing the complementarity between relationships and IT in practice is fraught with considerable tension. This study of WebGA, a bricks-and-clicks dotcom, highlights how the use of the self-serve technology made it more difficult for sales reps to build and maintain embedded relationships with their customers. The use of IT altered the nature and quality of information shared by the participants, undermined the ability of sales reps to provide consulting services to customers, reduced the frequency of their interaction, and prompted sales reps to expend social capital to promote customers’ technology adoption. These changes produced intended and unintended shifts in the network relations enacted by WebGA and its customers, and raised serious challenges to the viability of WebGA’s business model."
/doi/10.1287/mnsc.2019.3399," We study the role of vertical differentiation in the adoption of LEED (Leadership in Energy & Environmental Design), a multitier environmental building certification system. Our identification strategy relies on the timing of adoption and shows that builders seek to differentiate from each other by choosing a different certification level from previously certified buildings. A common concern in this framework is that mean-reverting behavior could be mistaken for differentiation. We develop a new method for establishing the importance of strategic interactions based on simulating from a model with independent choice and unobserved heterogeneity, and showing that such a model cannot generate the level of interaction that we observe. Finally, we estimate a model that incorporates both differentiation incentives and correlated market-level unobservables and use our estimates from this model to simulate the impact of reducing the number of LEED tiers from four to two. The simulations indicate that environmental investments depend on the location of the threshold between tiers. This paper was accepted by Bruno Cassiman, business strategy."
/doi/10.1287/mnsc.2016.2483," Employers and colleges value individuals with leadership service, but there is limited evidence on whether leadership service itself creates skills. Identification in this context has proved difficult because settings in which leadership service accrues to individuals for ostensibly random reasons are rare. In this study we estimate the effects of random assignment to classroom leadership positions in a Chinese secondary school. We find that leadership service increases test scores, increases students’ political popularity in the classroom, makes students more likely to take initiative, and shapes students’ beliefs about the determinants of success. The results suggest that leadership service may impact human capital and is not solely a signal of preexisting skills. Data are available at http://dx.doi.org/10.1287/mnsc.2016.2483 . This paper was accepted by John List, behavioral economics ."
/doi/10.1287/mnsc.2021.4037," We present evidence that unnecessarily complex disclosure can result from strategic incentives to shroud information. In our laboratory experiment, senders are required to report their private information truthfully but can choose how complex to make their reports. We find that senders use complex disclosure more than half the time. This obfuscation is profitable because receivers make systematic mistakes in assessing complex reports. Regression and structural analysis suggest that these mistakes could be driven by receivers who are naive about the strategic use of complexity or overconfident about their ability to process complex information. This paper was accepted by Yan Chen, behavioral economics and decision analysis."
/doi/10.1287/inte.6.1pt2.54," This paper reports a significant combination of a linear-programming model of the Liberty, a communication system which visually depicts the model's output by electronically-produced graphics, and a planning concept which has produced a new, more sensitive approach to asset/liability management of a banking organization in an increasingly volatile financial environment. During the past decade, banks generally have increased leverage and reduced liquidity, thereby making them increasingly vulnerable to interest rate volatility. The Management Reporting System (MRS) described is a practical and unique approach in marrying the various sophisticated disciplines necessary for effective management given such constraints. Liberty's Chairman credited the system with 25¢ per share of the 1973 Operating Earnings and noted that the mix of bank assets and liabilities now can be guided by precise, automated facts, rather than by mere “seat-of-the-pants” instinct. In its 1972 Annual Report, the Corporation stated its 1973 earning's goal “because of the reliable way our Management Reporting System has functioned in 1972.” That objective was met even though economic conditions were vastly different than assumed. The MRS's use permitted the timely adjustments necessary to manage earnings and achieve the publicly stated objective. The paper also explores a more realistic and sensitive approach to liquidity management developed at Liberty. Its impact and value was not only demonstrated during the 1974 liquidity crunch but by its adoption at several of the leading banks across the United States."
/doi/10.1287/opre.50.2.375.428," We consider a firm that provides multiple services using both specialized and flexible capacity. The problem is formulated as a two-stage, single-period stochastic program. The firm invests in capacity before the actual demand is known and optimally assigns capacity to customers when demand is realized. Sample applications include a car rental company's use of mid-sized cars to satisfy unexpectedly high demand for compact cars and an airline's use of business-class seats to satisfy economy-class demand. We obtain an analytical solution for a particular case, when services may be upgraded by one class. The simple form of the solution allows us to compare the optimal capacities explicitly with a solution that does not anticipate flexibility. Given that demand follows a multivariate normal distribution, we analytically characterize the effects of increasing demand correlation on the optimal solution. For the case with two customer classes, the effects of demand correlation are intuitive: Increasing correlation induces a shift from flexible to dedicated capacity. When there are three or more classes, there are also adjustments to the resources not directly affected by the correlation change. As correlation rises, these changes follow an alternating pattern (for example, if the optimal capacity of one resource rises, then the optimal capacity of the adjacent resource falls). These results make precise conjectures based on numerical experiments that have existed in the literature for some time."
/doi/10.1287/mnsc.2019.3534," We report the results of an experiment in which a company, Firm Vary, temporarily suspended its sponsored search advertising campaign on Google in randomly selected advertising markets in the United States. By shutting off its ads, Firm Vary lost customers, but only 63% as many as a nonexperimental estimate would have suggested. Following the experiment, Firm Vary merged with its closest competitor, Firm Fixed. Using combined data from both companies, the experiment revealed that spillover effects of Firm Vary’s search advertising on Firm Fixed’s business and its marketing campaigns were surprisingly small, even in the market for Firm Vary’s brand name as a keyword search term, where the two firms were effectively duopsonists. This paper was accepted by Eric Anderson, marketing ."
/doi/10.1287/mnsc.2017.2946," We present a model with dynamic investment flows, where fund managers have the ability to generate excess returns, and study how forcing them to commit part or all of their personal wealth to the fund they manage affects fund risk taking. We contrast the behavior of a manager who may invest her personal wealth in a private account to a manager who is either forced to commit her wealth to the fund she manages or not allowed to hold risky assets held by the fund privately. We show that a fund managed by a manager with higher ability does not necessarily achieve higher expected returns but achieves lower idiosyncratic volatility. For a manager with constant ability, restrictions placed on her personal account do not influence her choices in the fund, while for a manager whose ability varies stochastically, they result in higher expected returns and idiosyncratic volatilities. Fund strategies can be nonmonotone both in the manager’s commitment level and the ratio of manager to investor wealth. Our results are robust to incomplete information and to competing managers with correlated ability. The internet appendix is available at https://doi.org/10.1287/mnsc.2017.2946 . This paper was accepted by Neng Wang, finance."
/doi/10.1287/opre.2020.1997," Under full substitutability of preferences, it is known that a competitive equilibrium exists in trading networks and is equivalent to (chain) stable outcomes. In this paper, we formulate the problem of finding an efficient set of trades as a generalized submodular flow problem in a suitable network. Existence of a competitive equilibrium and its equivalence with the seemingly weaker notion of stability follow directly from the optimality conditions of the flow problem. Our formulation enables us to perform comparative statics with respect to the number of buyers, sellers, and trades. For instance, we establish that if a new buyer is added to the economy, at an equilibrium the prices of all existing trades increase. In addition, we give a polynomial time algorithm for finding competitive equilibria in trading networks and testing (chain) stability. Funding : O. Candogan gratefully acknowledges financial support from the University of Chicago Booth School of Business. M. Epitropou gratefully acknowledges financial support from the Department of Electrical and Systems Engineering, University of Pennsylvania. The research of R.V. Vohra was supported in part by the National Science Foundation [Grant AST-1343381]."
/doi/10.1287/mnsc.2020.3598," What are the determinants of in-house employment versus outsourcing in the service sector? I use detailed data on U.S. lobbying services to answer this question. I argue with a series of correlational exercises that firms tend to outsource lobbying tasks that demand a large amount of general skills, whereas they are more likely to assign firm-specific tasks to in-house lobbyists. I provide causal evidence that the need to do tasks that vary in their general skill component leads to a change in outsourcing. Using difference-in-difference estimations, I show that the 2010 British Petroleum oil spill increased the general skills needed by oil and gas firms and that, consequently, their use of lobbyists for hire increased. This paper was accepted by Joshua Gans, business strategy."
/doi/10.1287/mnsc.1040.0315," Computing the optimal portfolio policy of an investor facing capital gains tax is a challenging problem: because the tax to be paid depends on the price at which the security was purchased (the tax basis), the optimal policy is path dependent and the size of the problem grows exponentially with the number of time periods. Dammon et al. (2001, 2002, 2004), Garlappi et al. (2001), and Gallmeyer et al. (2001) address this problem by approximating the exact tax basis by the weighted average purchase price. Our contribution is threefold. First, we show that the structure of the problem has several attractive features that can be exploited to determine the optimal portfolio policy using the exact tax basis via nonlinear programming. Second, we characterize the optimal portfolio policy in the presence of capital gains tax when using the exact tax basis. Third, we show that the certainty equivalent loss from using the average tax basis instead of the exact basis is very small: it is typically less than 1% for problems with up to 10 periods, and this result is robust to the choice of parameter values and to the presence of transaction costs, dividends, intermediate consumption, labor income, tax reset provision at death, and wash-sale constraints."
/doi/10.1287/opre.2015.1381," We study a dynamic game in which short-run players repeatedly play a symmetric, strictly supermodular game whose payoffs depend on a fixed unknown state of nature. Each short-run player inherits the beliefs of his immediate predecessor in addition to observing the actions of the players in his social neighborhood in the previous stage. Because of the strategic complementary between their actions, players have the incentive to coordinate with others and learn from them. We show that in any Markov Bayesian equilibrium of the game, players eventually reach consensus in their actions. They also asymptotically receive similar payoffs despite initial differences in their access to information. We further show that, if the players’ payoffs can be represented by a quadratic function, then the private observations are optimally aggregated in the limit for generic specifications of the game. Therefore, players asymptotically coordinate on choosing the best action given the aggregate information available throughout the network. We provide extensions of our results to the case of changing networks and endogenous private signals."
/doi/10.1287/mnsc.2018.3131," This paper studies the effect of providing feedback to college students on their position in the grade distribution by using a natural field experiment. This information was updated every six months during a three-year period. We find that greater grades transparency decreases educational performance, as measured by the number of examinations passed and grade point average (GPA). However, self-reported satisfaction, as measured by surveys conducted after feedback is provided but before students take their examinations, increases. We provide a theoretical framework to understand these results, focusing on the role of prior beliefs and using out-of-trial surveys to test the model. In the absence of treatment, a majority of students underestimate their position in the grade distribution, suggesting that the updated information is “good news” for many students. Moreover, the negative effect on performance is driven by those students who underestimate their position in the absence of feedback. Students who overestimate initially their position, if anything, respond positively. The performance effects are short lived—by the time students graduate, they have similar accumulated GPA and graduation rates. This paper was accepted by John List, behavioral economics."
/doi/10.1287/orsc.10.5.569," Many scholars have described organization form as a management tool in the alignment of organization and environment. As the environment of many companies becomes more chaotic, the exploration of organization forms characterized by flexibility and adaptability has been intensifying. When reviewing existing literature on new organization forms, several gaps become apparent. These gaps can be traced back to the artificial separation between the macrolevel and the firm level of analysis and the prevalence of a static notion of form. To contribute to a more encompassing theory of new organization forms, a coevolutionary perspective is suggested. In this perspective, contextual variation of macrolevel management logics is proposed as a key mediator in the coevolution of organization and environment. At the firm level, the contextual variation of management logics is reflected in shared managerial schemas underlying strategic design actions. The resulting coevolutionary model shows how contextual applications of management logics may be a source of variation in new organization forms. On the basis of a literature review, three management logics, representing ideal types, are described: classical management logic, modern management logic, and postindustrial management logic. These logics are related to three levers of design actions which reflect fundamentally different interventions in form. Linking management logics to design levers results in a set of propositions to be tested in future empirical research."
/doi/10.1287/mnsc.2020.3901," We conducted a field experiment in a Dutch retail chain of 122 stores to study the interaction between team incentives, team social cohesion, and team performance. Theory predicts that the effect of team incentives on team performance increases with the team’s social cohesion because social cohesion reduces free-riding behavior. In addition, team incentives may lead to more coworker support or to higher peer pressure and thereby, can affect the team’s social cohesion. We introduced short-term team incentives in a randomly selected subset of stores and measured for all stores, both before and after the intervention, the team’s sales performance and the team’s social cohesion as well as coworker support and peer pressure. The average treatment effect of the team incentive on sales is 1.5 percentage points, which does not differ significantly from zero. In line with theory, the estimated treatment effect increases with social cohesion as measured before the intervention. Social cohesion itself is not affected by the team incentives. This paper was accepted by Yan Chen, decision analysis."
/doi/10.1287/mnsc.2018.3079," We analyze whether growth firms should delay current investment to hoard cash in order to reduce dilution from external financing. This hoarding motive is the natural counterpart to saving cash as a precaution to help secure funding for future investment opportunities. However, the two motives lead to fundamentally different implications for hoarding and for how cash interacts with key financial and investment decisions. In particular, our paper contributes to understanding why firms choosing private over public financing hoard less, and why product market competition has an ambivalent impact on the public–private choice. This paper was accepted by Gustavo Manso, finance."
/doi/10.1287/mnsc.2013.1755," In a market context, a status effect occurs when actors are accorded differential recognition for their efforts depending on their location in a status ordering, holding constant the quality of these efforts. In practice, because it is very difficult to measure quality, this ceteris paribus proviso often precludes convincing empirical assessments of the magnitude of status effects. We address this problem by examining the impact of a major status-conferring prize that shifts actors' positions in a prestige ordering. Specifically, using a precisely constructed matched sample, we estimate the effect of a scientist becoming a Howard Hughes Medical Institute (HHMI) Investigator on citations to articles the scientist published before the prize was awarded. We do find evidence of a postappointment citation boost, but the effect is small and limited to a short window of time. Consistent with theories of status, however, the effect of the prize is significantly larger when there is uncertainty about article quality, and when prize winners are of (relatively) low status at the time of election to the HHMI Investigator Program. This paper was accepted by David Hsu, entrepreneurship and innovation."
/doi/10.1287/serv.2017.0179," Long-term contracts along with their various internal and external variables lead to inevitable changes in the financial estimation of public–private partnership (PPP) projects. In these cases, and during renegotiations, the excess of benefit/cost should be shared among the key stakeholders, including the private contractor, government, and end users, in terms of contract extensions, annual subsidies, and tariff adjustments, respectively. However, while the allocation of excess befit/cost is an important factor in the successful execution of PPP projects, few methods have considered this issue. Moreover, these methods have rarely involved all three stakeholders and often have evaluated a limited number of possible solutions by qualitative techniques. To address the fair allocation of excess benefit/cost, this paper investigates some sharing mechanisms based on cooperative game concepts, including the core, the nucleolus, and the Shapley value. These mechanisms can improve the renegotiation regulations in PPP contracts and help decision makers manage renegotiations with better structure and supervision. The proposed allocation mechanisms are shown to be fair and practical approaches to managing the financial viability in PPP contracts."
/doi/10.1287/isre.1110.0408," We econometrically evaluate information worker productivity at a midsize executive recruiting firm and assess whether the knowledge that workers accessed through their electronic communication networks enabled them to multitask more productively. We estimate dynamic panel data models of multitasking, knowledge networks, and productivity using several types of micro-level data: (a) direct observation of more than 125,000 email messages over a period of 10 months; (b) detailed accounting data on individuals' project output and team membership for more than 1,300 projects spanning five years; and (c) survey and interview data about the same workers' IT skills, IT use, and information sharing. We find that (1) more multitasking is associated with more project output, but diminishing marginal returns, and (2) recruiters whose network contacts have heterogeneous knowledge—an even distribution of expertise over many project types—are less productive on average but more productive when juggling diverse multitasking portfolios. These results show how multitasking affects productivity and how knowledge networks, enabled by IT, can improve worker performance. The methods developed can be replicated in other settings, opening new frontiers for research on social networks and IT value."
/doi/10.1287/mnsc.1080.0913," There is an emerging debate in the scholarly literature regarding the extent to which academic human capital contributes to firm performance. This debate centers on the nature of an academic scientist's human capital and its institutional specificity. Using data on the human capital of biomedical scientists developed during their careers in academe, this paper analyzes how the depth of their scientifically and commercially oriented academic human capital contributes to firm performance when these scientists subsequently start or join for-profit firms. We find that the scientific and commercial components of an academic scientist's human capital have differential effects on the performance of research and invention tasks at the firm. We also find that the contribution of an academic scientist to a firm's patent productivity is decreasing with the depth of their scientifically oriented human capital, all else constant. These results support the view that academic human capital is heterogeneous and has an institutional specificity that mediates its value when applied in a commercialization environment."
