link,abstract
/doi/10.1287/mnsc.1050.0492," Faced with fragmented markets, saturated and demanding customers, and global competition, firms increasingly must design and offer a line of innovative, quality-differentiated products to target customers with differing willingness to pay (WTP). In this context, designing a special class of products that we term development-intensive products (DIPs)—for which the fixed costs of development far outweigh the unit-variable costs—presents some unique managerial challenges. Examples of such development-intensive offerings abound in a number of industries, including the pharmaceutical, information, and entertainment sectors of the economy. Our contributions in this paper are threefold: (a) to show that managerial insights from the traditional approach to product-line design developed for unit-variable cost-intensive products do not carry over to DIPs, (b) to present new mechanisms and managerial guidelines for designing a family of products for which development costs cannot be ignored, and (c) to illustrate the insights with an extended industry example. We find that the design approach based on degrading (or subtracting value from) a high-end product to obtain a subsumed low-end edition , shown in the literature to be an effective approach for designing unit cost-intensive products, can be inappropriate for DIPs. This limitation of value subtraction has implications for the number of variants and the sequence in which they are developed. As an alternative to a subsumed product-design strategy, we propose and examine the overlapped product-design approach , in which a low-end product is not completely subsumed within its high-end counterpart, but differentiated on additional vertical quality dimensions. Our results both explain the recent challenges of firms with subsumed low-end products and guide them in designing a product line to successfully address emerging low-end market segments."
/doi/10.1287/isre.1100.0290," This study extends existing information technology (IT) productivity research by evaluating the contributions of spending in IT outsourcing using a production function framework and an economywide panel data set from 60 industries in the United States over the period from 1998 to 2006. Our results demonstrate that IT outsourcing has made a positive and economically meaningful contribution to industry output and labor productivity. It has not only helped industries produce more output, but it has also made their labor more productive. Moreover, our analysis of split data samples reveals systematic differences between high and low IT intensity industries in terms of the degree and impact of IT outsourcing. Our results indicate that high IT intensity industries use more IT outsourcing as a percentage of their output, but less as a percentage of their own IT capital, and they achieve higher returns from IT outsourcing. This finding suggests that to gain greater value from IT outsourcing, firms need to develop IT capabilities by intensively investing in IT themselves. By comparing the results from subperiods and analyzing a separate data set for the earlier period of 1987–1999, we conclude that the value of IT outsourcing has been stable from 1998 to 2006 and consistent over the past two decades. The high returns we find for IT outsourcing also suggest that firms may be underinvesting in IT outsourcing."
/doi/10.1287/mnsc.1100.1286," Reference-dependent preferences have been well accepted in decision sciences, experimental economics, behavioral finance, and marketing. However, we still know very little about how decision makers form and update their reference points given a sequence of information. Our paper provides some novel experiments in a financial context to advance the understanding of reference-point formation over time. Our subjects' reference price is best described as a combination of the first and the last price of the time series, with intermediate prices receiving smaller and nondecaying weights. Hence, reference prices are not recursive. We provide a parsimonious formula to predict the reference points, which we test out-of-sample. The fit of the model is reasonably good. This paper was accepted by George Wu, decision analysis."
/doi/10.1287/mnsc.1040.0334," In this paper we present a new improved design for multiobject auctions and report on the results of experimental tests of that design. We merge the better features of two extant but very different auction processes, the Simultaneous Multiple Round (SMR) design used by the FCC to auction the electromagnetic spectrum and the Adaptive User Selection Mechanism (AUSM) of Banks et al. (1989, “Allocating uncertain and unresponsive resources: An experimental approach,” RAND Journal of Economics , Vol. 20, No. 1, pp. 1–25). Then, by adding one crucial new feature, we are able to create a new design, the Resource Allocation Design (RAD) auction process, which performs better than both. Our experiments demonstrate that the RAD auction achieves higher efficiencies, lower bidder losses, higher net revenues, and faster times to completion without increasing the complexity of a bidder's problem."
/doi/10.1287/mnsc.2015.2327," With a large nationwide retailer, we run a natural field experiment to measure the effects of energy use information disclosure, customer rebates, and sales agent incentives on demand for energy-efficient durable goods. Although a combination of large rebates plus sales incentives substantially increases market share, information and sales incentives alone each have zero statistical effect and explain at most a small fraction of the low baseline market share. Sales agents strategically comply only partially with the experiment, targeting information to more interested consumers but not discussing energy efficiency with the disinterested majority. These results suggest that seller-provided information is not a major barrier to energy-efficiency investments at current prices in this context. Data, as supplemental material, are available at http://dx.doi.org/10.1287/mnsc.2015.2327 . This paper was accepted by John List, behavioral economics ."
/doi/10.1287/mnsc.2019.3412," Platform marketplaces can potentially steer buyers to certain sellers by recommending or guaranteeing those sellers. Money-back guarantees—which create a direct financial stake for the platform in seller performance—might be particularly effective at steering as they align buyer and platform interests in creating a good match. We report the results of an experiment in which a platform marketplace—an online labor market—guaranteed select sellers for treated buyers. The presence of a guarantee strongly steered buyers to these guaranteed sellers, but offering guarantees did not increase sales overall, suggesting financial risk was not determinative for the marginal buyer. This preference for guaranteed sellers was not the result of their lower financial risk, but rather because buyers viewed the platform’s decision to guarantee as informative about relative seller quality. Indeed, a follow-up experiment showed that simply recommending the sellers that the platform would have guaranteed was equally effective at steering buyers. This paper was accepted by Chris Forman, information systems."
/doi/10.1287/mnsc.1070.0729," Probability forecasters who are rewarded via a proper scoring rule may care not only about the score, but also about their performance relative to other forecasters. We model this type of preference and show that a competitive forecaster who wants to do better than another forecaster typically should report more extreme probabilities, exaggerating toward zero or one. We consider a competitive forecaster's best response to truthful reporting and also investigate equilibrium reporting functions in the case where another forecaster also cares about relative performance. We show how a decision maker can revise probabilities of an event after receiving reported probabilities from competitive forecasters and note that the strategy of exaggerating probabilities can make well-calibrated forecasters (and a decision maker who takes their reported probabilities at face value) appear to be overconfident. However, a decision maker who adjusts appropriately for the misrepresentation of probabilities by one or more forecasters can still be well calibrated. Finally, to try to overcome the forecasters' competitive instincts and induce cooperative behavior, we develop the notion of joint scoring rules based on business sharing and show that these scoring rules are strictly proper."
/doi/10.1287/mnsc.2019.3443," We examine firm and industry characteristics associated with outsourcing and the relation between outsourcing and capital structure using a unique database of outsourcing purchase contracts. We find that highly valued, profitable firms with high-value added per employee and suppliers farther away with higher competition are more likely to outsource using purchase contracts. In addition, we document that firms that operate in industries with more severe import penetration and fewer fixed assets are more likely to outsource using purchase contracts. Examining the outside purchase contract and leverage decisions, we find that the outsourcing decision is associated with less leverage. Our results are consistent with firms that choose to use purchase contracts using less leverage to mitigate the potential loss of relation-specific investments of contracting parties that can occur with financial distress or bankruptcy. This paper was accepted by Gustavo Manso, finance ."
/doi/10.1287/mksc.2016.1021," Chronic diseases, which account for 75% of healthcare expenditure, are of particular importance in trying to understand the rapid growth of healthcare costs over the last few decades. Individuals suffering from chronic diseases can consume three types of services: secondary preventive care, which includes diagnostic tests; primary preventive care, which consists of drugs that help prevent the illness from getting worse; and curative care, which includes surgeries and expensive drugs that provide a quantum boost to the patient’s health. Although the majority of cases can be managed by preventive care, most consumers opt for more expensive curative care that leads to a substantial increase in overall costs. To examine these inefficiencies, we build a model of consumers’ annual medical insurance plan decisions and periodic consumption decisions and apply it to a panel data set. Our results indicate that there exists a sizable segment of consumers who purchase more comprehensive plans than needed because of high uncertainty vis-à-vis their health status, and that once in the plan, they opt for curative care even when their illness could be managed through preventive care. We examine how changing cost-sharing characteristics of insurance plans and providing more accurate information to consumers via secondary preventive care can reduce these inefficiencies. Data and the Web appendix are available at https://doi.org/10.1287/mksc.2016.1021 ."
/doi/10.1287/mnsc.2020.3895," What are the long-term consequences of compensation changes? Using data from an inbound sales call center, we study employee responses to a compensation change that ultimately reduced take-home pay by 7% for the average affected worker. The change caused a significant increase in the turnover rate of the firm’s most productive employees, but the response was relatively muted for less productive workers. On-the-job performance changes were minimal among workers who remained at the firm. We quantify the cost of losing highly productive employees and find that their heightened sensitivity to changes in compensation limits managers’ ability to adjust incentives. Our results speak to a driver of compensation rigidity and the difficulty managers face when setting compensation. This paper was accepted by Lamar Pierce, organizations."
/doi/10.1287/mnsc.2021.3966," Which factors shape the commercialization of academic scientific discoveries via startup formation? Prior literature has identified several contributing factors but does not address the fundamental problem that the commercial potential of a nascent discovery is generally unobserved, which potentially confounds inference. We construct a sample of approximately 20,000 “twin” scientific articles, which allows us to hold constant differences in the nature of the advance and more precisely examine characteristics that predict startup commercialization. In this framework, several commonly accepted factors appear not to influence commercialization. However, we find that teams of academic scientists whose former collaborators include “star” serial entrepreneurs are much more likely to commercialize their own discoveries via startups, as are more interdisciplinary teams of scientists. This paper was accepted by Sridhar Tayur, entrepreneurship and innovation."
/doi/10.1287/mksc.1110.0659," The goal of this paper is to study the behavior of consumers, dealers, and manufacturers in the car sector and present an approach that can be used by managers and policy makers to investigate the impact of significant demand shocks on profits, prices, and dealer networks. More specifically, we investigate consumer demand, substitution patterns, and price decisions across different cars and dealer locations to identify dealerships with low margins or high fixed costs and measure the value of closing down dealerships for manufacturers. We apply our model empirically to the San Diego area using a transactional data set with information about the locations of dealers and consumers, as well as manufacturer and retail prices. We find strong consumer disutility for travel and find that dealers have local demand areas that are shared with a small set of competitors. We show that a reduction of market demand by 30% over two years, similar to the economic crisis of 2008–2009, results in an annual drop in prices of approximately 11%. We discuss this price drop in the context of the 2009 federal policy measure known as the Car Allowance Rebate System program. We compare predictions and actual dealership closings in the General Motors and Chrysler dealer networks as an application of our approach."
/doi/10.1287/mnsc.2019.3457," The transition of the advertising market from traditional media to the internet has induced a proliferation of marketing agencies specialized in bidding in the auctions that are used to sell ad space on the web. We analyze how collusive bidding can emerge from bid delegation to a common marketing agency and how this can undermine the revenues and allocative efficiency of both the generalized second-price auction (GSP, used by Google, Microsoft Bing, and Yahoo!) and the Vickrey–Clarke–Groves (VCG) mechanism (used by Facebook). We find that despite its well-known susceptibility to collusion, the VCG mechanism outperforms the GSP auction in terms of both revenues and efficiency. This paper was accepted by Gabriel Weintraub, revenue management and market analytics ."
/doi/10.1287/isre.2021.1018," We investigate whether revenue-maximizing auctioneers selling heterogeneous items will allow for combinatorial bidding in the presence of auctioneer competition. We compare the choice of auction format by two competing auctioneers with that of a single auctioneer. Bidders are heterogeneous in their demands, with some having synergies for items. We find that, even if a single auctioneer offers a combinatorial auction, competing auctioneers in a comparable setting will not. Instead, the competing auctioneers will segment the market by restricting allowable package bids in order to increase competition between bidders. This shows that it might not be advantageous for an online market platform to offer combinatorial auctions as a design option to competing auctioneers."
/doi/10.1287/mnsc.2019.3539," This study examines how product market peers affect lending relationships. We contend that firms are more likely to borrow from a bank that has previously lent to a peer to mitigate information asymmetry with the bank when potential information processing efficiencies are greater (i.e., information efficiency hypothesis), but there will be a decreased propensity to borrow from a shared lender when the costs of leaking proprietary information are greater (i.e., proprietary information leakage hypothesis). We find that, after bank mergers that involve peers’ lenders, firms are more likely to switch banks to avoid sharing the same lenders as a product market peer. In cross-sectional analyses, we find that after bank mergers that involve a peer’s bank, firms are less likely to switch when the firm’s financial reporting is more opaque and has greater monitoring needs, consistent with the information efficiency hypothesis. In contrast, firms are more likely to switch after bank mergers that involve a peer’s bank when the firm belongs to an industry with greater proprietary costs and when the bank has greater incentives to leak information, consistent with the proprietary cost hypothesis. This paper was accepted by Brian Bushee, accounting."
/doi/10.1287/moor.2016.0799," In the Anscombe-Aumann setup, we provide conditions for a collection of observations to be consistent with a well-known class of smooth ambiguity preferences (Klibanoff P, Marinacci M, Mukerji S (2005) A smooth model of decision making under ambiguity. Econometrica 73(6):1849–1892.). Each observation is assumed to take the form of an equivalence between an uncertain act and a certain outcome. We provide three results that describe these conditions for data sets of different cardinality. Our findings uncover surprising links between the smooth ambiguity model and classic mathematical results in complex and functional analysis."
/doi/10.1287/moor.23.4.983," The question of “fairly” allocating costs or cost-savings among the participants of a joint enterprise is frequently answered by finding the nucleolus of a related cooperative game. In connection with various routing, sequencing and scheduling situations, connected games often arise. Their common feature is that all the essential coalitions (whose breaking up into subcoalitions is disadvantageous for its members) are connected with respect to a fixed order of the players (any player between two members of a coalition is also a member of the coalition). In the literature, several special classes of connected games are discussed that are shown to be balanced. In this paper, an algorithm is presented that computes the nucleolus of a general n -person balanced connected game. The input is the array of the explicitly given values of the n ( n + 1)/2 connected coalitions. The algorithm generates a sequence of at most n ( n − 1)/2 payoff vectors starting from a special vertex of the nonempty core and ending in the nucleolus. By exploiting the special structure of connected games, the initial as well as the subsequent payoff vectors are obtained by evaluating some simple recursive formulas. It is shown that the algorithm requires at most O( n 4 ) time and O( n 2 ) space. A 5-person illustrative example is also given."
/doi/10.1287/mnsc.2020.3709," We use cooperative game theory to investigate multiplayer allocation problems under the almost diminishing marginal contributions (ADMC) property. This property indicates that a player’s marginal contribution to a non-empty coalition decreases as the size of the coalition increases. We develop ADMC games for such problems and derive a necessary and sufficient condition for the non-emptiness of the core. When the core is non-empty, at least one extreme point exists, and the maximum number of extreme points is the total number of players. The Shapley value may not be in the core, which depends on the gap of each coalition. A player can receive a higher allocation based on the Shapley value in the core than based on the nucleolus, if the gap of the player is no greater than the gap of the complementary coalition. We also investigate the least core value for ADMC games with an empty core. To illustrate the applications of our results, we analyze a code-sharing game, a group buying game, and a scheduling profit game. This paper was accepted by Chung Piaw Teo, optimization."
/doi/10.1287/opre.2019.1942," This paper presents an exact penalization theory of the generalized Nash equilibrium problem (GNEP) that has its origin from the renowned Arrow–Debreu general economic equilibrium model. Whereas the latter model is the foundation of much of mathematical economics, the GNEP provides a mathematical model of multiagent noncooperative competition that has found many contemporary applications in diverse engineering domains. The most salient feature of the GNEP that distinguishes it from a standard noncooperative (Nash) game is that each player’s optimization problem contains constraints that couple all players’ decision variables. Extending results for stand-alone optimization problems, the penalization theory aims to convert the GNEP into a game of the standard kind without the coupled constraints, which is known to be more readily amenable to solution methods and analysis. Starting with an illustrative example to motivate the development, this paper focuses on two kinds of coupled constraints, shared (i.e., common) and finitely representable. Constraint residual functions and the associated error bound theory play an important role throughout the development."
/doi/10.1287/orsc.2019.1294," Management practices explain an important part of the heterogeneity in firm productivity, but the literature has largely focused on manufacturing, while leaving out research in the industrial setting. A key managerial practice in industrial research projects is the use of autonomy (through the delegation of decision rights). Our paper clarifies the drivers and the effects of autonomy in settings where other managerial instruments are less effective. We discuss that in industrial research projects, autonomy is set for efficiency reasons—autonomy allows researchers to make more competent decisions about a specific problem—as well as for motivational considerations—autonomy motivates researchers to exert greater effort. We also argue that project - relevant capital —the resources that enhance the productivity of researchers on a given project—is a key driver of autonomy. We theorize that the efficiency and motivational channels have opposite implications for the relationship between project-relevant capital and autonomy and find that, empirically, this relationship is U-shaped, which is suggestive evidence of the presence of both channels."
/doi/10.1287/mnsc.2020.3632," Exposure to environmental cues triggers sudden preference reversals in several choice contexts, including consumption and intertemporal, social, and risky choices. This paper introduces a dual-self model of cue-triggered behavior that (1) is based on a general mechanism that makes it applicable to many choice contexts, (2) allows a sharp comparative analysis of the responsiveness to cues, (3) can explain a wide range of behavioral anomalies, from a cue-triggered present bias to high-frequency variations in social and risk preferences, and (4) can inform the design of managerial interventions and advertising strategies employing environmental cues. Testable restrictions combining choice and nonchoice data fully characterize the model. This paper was accepted by Manel Baucells, decision analysis."
/doi/10.1287/isre.1110.0394," The bullwhip effect is a major source of supply chain inefficiency. Whereas prior literature has identified a number of potential contributing factors and recommended such remedies as information sharing enabled by information technology (IT) or electronic linkage (EL), few studies have provided empirical support. We use industry-level data to examine whether EL use with buyer and supplier industries helps reduce the bullwhip effect as measured by inventory–demand variance ratio. Our major findings are that (1) EL use with supplier industries reduces the bullwhip effect, whereas (2), surprisingly, EL use with buyer industries increases it, but (3) this adverse effect tends to be mitigated by IT use. These findings point to the possible asymmetric effects of EL use in supply chains and provide a different perspective to the existing conclusions in the literature that EL use improves performance. Combining the above results, we have learned that the use of EL tends to behave differently depending on whether it is used upstream or downstream in the supply chain. This also sheds light on the conditions under which such investment may be more (or less) beneficial."
