link,abstract
/doi/10.1287/msom.1120.0389," In this paper, we examine the relationship between inventory levels and one-year-ahead earnings of retailers using publicly available financial data. We use benchmarking metrics obtained from operations management literature to demonstrate an inverted-U relationship between abnormal inventory growth and one-year-ahead earnings per share for retailers. We also find that equity analysts do not fully incorporate the information contained in retailers' abnormal inventory growth in their earnings forecasts, resulting in systematic biases. Finally, we show that an investment strategy based on abnormal inventory growth yields significant abnormal stock market returns."
/doi/10.1287/mnsc.2020.3690," This paper proposes a measure of dissimilarity between stochastic discount factors (SDFs) in different economies. The SDFs are made comparable using the respective bond prices as the numeraire. The measure is dimensionless, synthesizes features of the risk-neutral moments of excess currency returns, and can be extracted from currency option prices. Linking theory to data, we provide evidence gathered from (i) the cross section of 45 currency option prices, (ii) the time series of currency returns, (iii) estimated SDFs using model-free restrictions, and (iv) structural models in international finance. This paper was accepted by David Simchi-Levi, finance."
/doi/10.1287/orsc.1100.0614," Online communities (OCs) are a virtual organizational form in which knowledge collaboration can occur in unparalleled scale and scope, in ways not heretofore theorized. For example, collaboration can occur among people not known to each other, who share different interests and without dialogue. An exploration of this organizational form can fundamentally change how we theorize about knowledge collaboration among members of organizations. We argue that a fundamental characteristic of OCs that affords collaboration is their fluidity. This fluidity engenders a dynamic flow of resources in and out of the community—resources such as passion, time, identity, social disembodiment of ideas, socially ambiguous identities, and temporary convergence. With each resource comes both a negative and positive consequence, creating a tension that fluctuates with changes in the resource. We argue that the fluctuations in tensions can provide an opportunity for knowledge collaboration when the community responds to these tensions in ways that encourage interactions to be generative rather than constrained. After offering numerous examples of such generative responses, we suggest that this form of theorizing—induced by online communities—has implications for theorizing about the more general case of knowledge collaboration in organizations."
/doi/10.1287/mnsc.1110.1481," The existing outsourcing literature has generally overlooked the cost differential and contract negotiations between manufacturers and suppliers (by assuming identical cost structures and adopting the Stackelberg framework). One fundamental question yet to be addressed is whether upstream suppliers' cost efficiency is always beneficial to downstream manufacturers in the presence of competition and negotiations . In other words, does low cost outsourcing always lead to a win–win outcome? To answer this question, we adopt a multiunit bilateral bargaining framework to investigate competing manufacturers' sourcing decisions. We analyze two supply chain structures: one-to-one channels, in which each manufacturer may outsource to an exclusive supplier; and one-to-two channels, in which each manufacturer may outsource to a common supplier. We show that, under both structures, low cost outsourcing may lead to a win–lose outcome in which the suppliers gain and the manufacturers lose. This happens because suppliers' cost advantage may backfire on competing manufacturers through two negative effects. First, a decrease of upstream cost weakens a manufacturer's bargaining position by reducing her disagreement payoff (i.e., her insourcing profit) because the competing manufacturer can obtain a low cost position through outsourcing. Second, in one-to-two channels, the common supplier's bargaining position is strengthened with a lower cost because his disagreement payoff increases (i.e., his profit from serving only one manufacturer increases). The endogeneity of disagreement payoffs in our model highlights the importance of modeling firm negotiations under competition. Moreover, we identify an interesting bargaining externality between competing manufacturers when they outsource to a common supplier. Because the supplier engages in two negotiations, his share of profit from the trade with one manufacturer affects the total surplus of the trade with the other manufacturer. Because of this externality, surprisingly, as a manufacturer's bargaining power decreases, her profit under outsourcing may increase and it may be more likely for her to outsource. This paper was accepted by Yossi Aviv, operations management."
/doi/10.1287/mnsc.1060.0511," This paper examines how the knowledge-based view (KBV) can be applied to firm boundary decisions and the performance implications of those decisions. At the center of the paper is a theoretical and empirical examination of how firms most efficiently organize to solve different types of problems related to technological development, using the semiconductor industry as the empirical setting. Measures that capture important dimensions of performance support the proposition that organization affects performance in problem solving related to knowledge development. Integrated firms realize performance advantages when problem solving in technological development is ill structured and complex, while the same is true for specialized firms when problem solving in technological development is well structured and simple. Performance differences also arise from the presence of scale economies and scope economies."
/doi/10.1287/mnsc.2018.3254," We investigate the effect of auditing on promoting exports for private firms in emerging markets. Using a sample of private firms from 125 countries between 2006 and 2015, we show that firms that have their financial statements audited have more exports than firms that do not have their financial statements audited. To infer causality, we employ a regression discontinuity design (RDD). Using the discontinuity around the mandatory financial audit threshold, we find that firms slightly above the threshold have more exports than do firms that are slightly below the threshold. We also exploit the countries with exogenous regulation shocks to the mandatory audits. Using the difference-in-differences (DiD) design, we find that firms that are exempted from mandatory audits have less exports subsequent to the regulation change. Further analyses reveal that the effect of auditing is more pronounced in countries with higher audit quality and for firms with limited alternative information. Our findings suggest that the auditing function promotes exports—an important economic consequence for the global economic development. This paper was accepted by Shivaram Rajgopal, accounting."
/doi/10.1287/mnsc.2020.3656," Many operational settings share the following three features: (i) a centralized planning system allocates tasks to workers or service providers, (ii) the providers generate value by completing the tasks, and (iii) the completion of tasks influences the providers’ welfare. In such cases, the planning system’s allocations often entail trade-offs between the service providers’ welfare and the total value that is generated (or that accrues to the system itself), and concern arises that allocations that are good under one metric may perform poorly under the other. We propose a broad framework for quantifying the magnitude of value losses when allocations are restricted to satisfy certain desirable guarantees to the service providers. We consider a general class of guarantees that includes many considerations of practical interest arising (e.g., in the design of sustainable two-sided markets) in workforce welfare and compensation, or in sourcing and payments in supply chains, among other application domains. We derive tight bounds on the relative value loss and show that this loss is limited for any restriction included in our general class. Our analysis shows that when many providers are present, the largest losses are driven by fairness considerations, whereas when few providers are present, they are driven by the heterogeneity in the providers’ effectiveness to generate value; when providers are perfectly homogenous, the losses never exceed 50%. We study additional loss drivers and find that less variability in the value of jobs and a more balanced supply-demand ratio may lead to larger losses. Lastly, we demonstrate numerically using both real-world and synthetic data that the loss can be small in several cases of practical interest. This paper was accepted by Chung Piaw Teo, optimization."
/doi/10.1287/isre.1100.0288," Online storage service providers grant a way for companies to avoid spending resources on maintaining their own in-house storage infrastructure and thereby allowing them to focus on their core business activities. These providers, however, follow a fixed, posted pricing strategy that charges the same price in each time period and thus bear all the risk arising out of demand uncertainties faced by their client companies. We examine the effects of providing a spot market with dynamic prices and forward contracts to hedge against future revenue uncertainty. We derive revenue-maximizing spot and forward prices for a single seller facing a known set of buyers. We perform a simulation study using publicly available traffic data regarding Amazon S3 clients from Alexa.com to validate our analytical results. Our field study supports our analysis and indicates that spot markets alone can enhance revenues to Amazon, but this comes at the cost of increased risks due to the increased market share in the spot markets. Furthermore, adding a forward contract feature to the spot markets can reduce risks while still providing the benefits of enhanced revenues. Although the buyers incur an increase in costs in the spot market, adding a forward contract does not cause any additional cost increase while transferring the risk to the buyers. Thus, storage grid providers can greatly benefit by applying a forward contract alongside the spot market."
/doi/10.1287/opre.1090.0718," In this paper, we study a make-to-stock manufacturing system where two firms compete through dynamic pricing and inventory control. Our goal is to address competition (in particular a duopoly setting) together with the presence of demand uncertainty. We consider a dynamic setting where multiple products share production capacity. We introduce a demand-based fluid model where the demand is a linear function of the price of the supplier and of her competitor, the inventory and production costs are quadratic, and all coefficients are time dependent. A key part of the model is that no backorders are allowed and the strategy of a supplier depends on her competitor's strategy. First, we reformulate the robust problem as a fluid model of similar form to the deterministic one and show existence of a Nash equilibrium in continuous time. We then discuss issues of uniqueness and address how to compute a particular Nash equilibrium, i.e., the normalized Nash equilibrium."
/doi/10.1287/mnsc.1070.0730," Amanufacturer writes supply contracts with N buyers. Then, the buyers invest in innovation, and the manufacturer builds capacity. Finally, demand is realized, and the firms renegotiate the supply contracts to achieve an efficient allocation of capacity among the buyers. The court remedy for breach of contract (specific performance versus expectation damages) affects how the firms share the gain from renegotiation, and hence how the firms make investments ex ante. The firms may also engage in renegotiation design, inserting simple clauses into the supply contract to shape the outcome of renegotiation. For example, when a buyer grants a financial “hostage” to the manufacturer or is charged a per diem penalty for delay in bargaining, the manufacturer captures the gain from renegotiation. “Tradable options,” which grant buyers the right to trade capacity without intervention from the manufacturer, return the gain from renegotiation to the buyers. This paper proves that, under surprisingly general conditions, the firms can coordinate their investments with the simplest of supply contracts (fixed-quantity contracts). This may require renegotiation design, and certainly requires that the firms understand the breach remedy and set their contract parameters accordingly."
/doi/10.1287/mnsc.2019.3319," We propose a new measure of fund investment skill, active fund overpricing (AFO), encapsulating the fund’s active share of investments, the direction of fund active bets with regard to mispriced stocks, and the dispersion of mispriced stocks in the fund’s investment opportunity set. We find that fund activeness is not sufficient for outperformance: high (low) AFO funds taking active bets on the wrong (right) side of stock mispricing achieve inferior (superior) fund performance. However, high AFO funds receive higher flows during periods of high investor sentiment, when the performance–flow relation becomes weaker. This paper was accepted by Karl Diether, finance."
/doi/10.1287/mksc.2017.1079," Political advertising is controversial, as there is widespread concern about money from political action committees (PACs and super PACs) distorting the democratic process. Studying advertising effectiveness is, however, a challenging topic for several reasons, including the endogenous nature of fundraising and ad spending rates. However, the extensive use of targeting based on designated marketing areas (DMAs) creates a setting in which neighboring counties with comparable demographics receive different levels of advertising exposure. In this paper, we leverage these advertising discontinuities along DMA borders to study the relative effectiveness of political advertising on vote shares and turnout rates in 2010 and 2012 senatorial elections. We find that negative advertising sponsored by PACs is significantly less effective than that sponsored by candidates in affecting two-party vote shares and voter turnout. A 1% increase in negative advertising by the candidate produces a significant 0.015% lift in the candidate’s unconditional vote shares. By contrast, negative advertising from PACs is ineffective in increasing its supported candidate’s unconditional vote share. Further analysis reveals that the competitiveness of races moderates the effectiveness of political advertising, providing implications for those managing candidates’ campaigns, PACs, and super PACs. Data and the online appendix are available at https://doi.org/10.1287/mksc.2017.1079 ."
/doi/10.1287/serv.2.1_2.102," Service-based industries now dominate the most advanced economies of the world. There is, however, no fully interdisciplinary foundation for research into the development of service, per se. The creation of a service science has been proposed, which would bring into question many traditional assumptions about economics. This paper explores service as a science, and proposes that the biological concept of mutualism be used as one aspect for developing a foundation of service science. [ Service Science , ISSN 2164-3962 (print), ISSN 2164-3970 (online), was published by Services Science Global (SSG) from 2009 to 2011 as issues under ISBN 978-1-4276-2090-3.]"
/doi/10.1287/orsc.13.5.459.7811," Adaptation to radical change is central to research in organization theory, and some of the most dramatic examples of environmental change have occurred recently in transition economies such as China. I take advantage of change during China's economic reform to study the relative importance of organizational and environmental factors in producing innovative managerial response. I find that strategic choice predicted innovation in the early stages of reform, but environmental factors increased in salience over time. Intrafirm support, Communist Party connections, and a market orientation produced innovation early in reform. Simple imitation of others was also salient in early years. As reform progressed, managers increasingly imitated other profitable firms and drew on their own experience. My results inform an understanding of both the process by which innovation occurs and firm behavior in transition economies."
/doi/10.1287/isre.1050.0045," Grounded in the innovation diffusion literature and the resource-based theory, this paper develops an integrative research model for assessing the diffusion and consequence of e-business at the firm level. Unlike the typical focus on adoption as found in the literature, we focus on postadoption stages, that is, actual usage and value creation. The model thus moves beyond dichotomous “adoption versus nonadoption” and accounts for the “missing link”—actual usage—as a critical stage of value creation. The model links technological, organizational, and environmental factors to e-business use and value, based on which a series of hypotheses are developed. The theoretical model is tested by using structural equation modeling on a dataset of 624 firms across 10 countries in the retail industry. To probe deeper into whether e-business use and value are influenced by economic environments, two subsamples from developed and developing countries are compared. The study finds that technology competence, firm size, financial commitment, competitive pressure, and regulatory support are important antecedents of e-business use. In addition, the study finds that, while both front-end and back-end capabilities contribute to e-business value, back-end integration has a much stronger impact. While front-end functionalities are becoming commodities, e-businesses are more differentiated by back-end integration. This is consistent with the resource-based theory because back-end integration possesses the value-creating characteristics of resources (e.g., firm specific, difficult to imitate), which are strengthened by the Internet-enabled connectivity. Our study also adds an international dimension to the innovation diffusion literature, showing that careful attention must be paid to the economic and regulatory factors that may affect technology diffusion across different countries."
/doi/10.1287/mnsc.44.7.950," We show that a modified base-stock policy is optimal for multiproduct, infinite-horizon production-inventory systems, where demand for the products is random and the products share a finite resource every period. We characterize the optimal policy for the case of homogeneous products. Because of the difficulty in computing the optimal base-stock levels for the heterogeneous case, we propose a heuristic that is simple enough for practical applications. We present numerical results that suggest that the heuristic yields near-optimal solutions."
/doi/10.1287/orsc.8.2.126," Studies of competition typically have two underlying assumptions: that competition occurs within the boundaries of industries or markets and that all firms in a market or industry are affected equally by competitive pressures. The concept of multipoint competition challenges both assumptions. Multipoint theory addresses how different levels of contact between firms across multiple markets affect competition in individual markets. Its main argument is that high levels of contact between firms across markets will induce mutual forbearance, causing multipoint competitors to refrain from aggressively attacking each other. The restraint stems from the fact that high levels of intermarket contact enable a firm to respond to an aggressive action by a multipoint rival in markets other than the one in which the action takes place. That possibility raises the potential costs of aggressive moves and serves as a credible deterrent, especially if a firm can respond in several markets. In addition, multipoint competition helps firms to interpret their rivals' intentions and signal their own, reducing the likelihood of costly misunderstandings. The authors elaborate on those ideas to examine how a hospital's degree of intermarket contact with its competitors in a particular service market affects the likelihood that it will exit that market. They find that hospitals are less likely to exit markets in which they meet large numbers of their multipoint rivals. As a result of mutual forbearance, competitive rivalry is reduced across the markets that multipoint rivals share, lessening the types of pressures that typically prompt market exit. With lower levels of competitive rivalry, markets shared by multipoint rivals are relatively more hospitable environments in which to operate and are less likely to be exited. Rather than competing intensely, multipoint rivals appear to adopt a “live and let live” approach toward each other. The fact that multipoint contact across markets may lessen competitive pressures within individual markets has implications for the contact between firms in several settings. Multimarket contact can occur across different product or service markets and also across different geographic markets, thus affording an intriguing perspective for the investigation of the rivalry between emerging transnational firms. True transnationals, by successfully integrating global operations while still addressing local market concerns, have been seen by some as having the capabilities necessary for successful performance in international competition. Perhaps transnational firms, because they have an integrated decision-making structure, can coordinate their actions to reduce competitive rivalry with each other across the markets they share. If so, markets dominated by transnationals may become more stable than the current state of international competition would predict."
/doi/10.1287/mnsc.2013.1729," Contrary to offshore hedge funds, U.S.-domiciled (“onshore”) funds are subject to strict marketing prohibitions, accredited investor requirements, a limited number of investors, and taxable accounts. We exploit these differences to test predictions about organizational design, investment strategy, capital flows, and fund performance. We find that onshore funds are associated with greater share restrictions, more liquid assets, and a reduced sensitivity of capital flows to superior past performance. We also find some evidence that onshore funds outperform offshore funds, depending on the sample period. The results suggest that a fund's investment and financial policies reflect differences in investor clienteles and the regulatory environment. This paper was accepted by Wei Xiong, finance."
/doi/10.1287/isre.2021.1003," This study examines the role of text-based direct messaging systems in online labor markets, which provide a communication channel between workers and employers, adding a personal touch to the exchange of online labor. We propose the effect of workers’ use of the direct messaging system on employers’ hiring decisions and conceptualize the information role of direct messaging. To empirically evaluate the information role of the direct messaging system, we leverage data on the direct messaging activities between workers and employers across more than 470,000 job applications on a leading online labor market. We report evidence that direct messaging with a prospective employer increases a worker’s probability of being hired by 8.9%. However, the degree to which workers benefit from direct messaging is heterogeneous, and the effect amplifies for workers approaching employers from a position of disadvantage (lacking tenure or fit with the job) and attenuates as more workers attempt to message the same prospective employer. The effects also depend on message content. In particular, we find that the benefits of direct messaging for workers depend a great deal on the politeness of the workers, and this “politeness effect” depends on several contextual factors. The beneficial effects are amplified for lower-status workers (i.e., workers lacking tenure and job fit) and workers who share a common language with the employer. At the same time, the beneficial effects weaken in the presence of typographical errors. These findings provide important insights into when and what to message to achieve favorable hiring outcomes in online employment settings."
/doi/10.1287/mnsc.2016.2476," We study how to optimally attract new customers using a referral program. Whenever a consumer makes a purchase, the firm gives her a link to share with friends, and every purchase coming through that link generates a referral payment. The firm chooses the referral payment function and consumers play an equilibrium in response. The optimal payment function is nonlinear and not necessarily monotonic in the number of successful referrals. If we approximate the optimal policy using a linear payment function, the approximation loss scales with the square root of the average consumer degree. Using a threshold payment, the approximation loss scales proportionally to the average consumer degree. Combining the two, using a linear payment function with a threshold bonus, we can achieve a constant bound on the approximation loss. This paper was accepted by Noah Gans, stochastic models and simulation ."
