link,abstract
/doi/10.1287/mnsc.2014.2041," This paper examines the interaction between venture risk, product market competition, and the entrepreneur’s choice between bank financing and venture capital (VC) financing. Under bank financing, a debt-type contract emerges as optimal, which allows the entrepreneur to retain full control of the venture and thus yields strong effort incentives, as long as the entrepreneur can service the debt repayment; however, this leads to liquidation in the case of default, making the venture’s success quite sensitive to exogenous, even temporary, shocks that may hinder debt repayment. Under VC financing, an equity-type contract emerges as optimal. Although it is not sensitive to exogenous shocks, this contract requires the entrepreneur to share a fraction of the rents with the financier, thus yielding lower effort incentives for the entrepreneur. There exists a threshold level of venture risk such that bank financing is optimal if and only if venture risk is below that threshold. Product market competition increases the value of stronger entrepreneurial incentives and thus increases the maximum level of risk the entrepreneur is willing to take before switching from bank financing to VC financing. This is a robust result that is shown to hold in various models of competition, including the Hotelling, Salop, Dixit–Stiglitz, and Cournot-to-Bertrand switch. This paper was accepted by Lee Fleming, entrepreneurship and innovation."
/doi/10.1287/mksc.15.4.379," Several studies have shown that promotions of national brands yield more effect than those of store brands (e.g., Allenby and Rossi 1991, Blattberg and Wisniewski 1989). However, the evolution of price-quality data available from Consumer Reports over the last 15 years seems to reveal a reduction of the quality gap between store brands and national brands, while price differences remain substantial. Simultaneously, the share of private label brands has increased ( Progressive Grocer 1994). In this context, we study whether we can maintain a view of the world where national brands may easily attract consumers from store brands through promotions, whereas store brands are relatively ineffective in attracting consumers from national brands by such means. We analyze consumer reactions to price discounts in a parsimonious preference model featuring loss aversion and reference-dependence along dimensions of price and quality (Hardie, Johnson, and Fader 1993, Tversky and Kahneman 1991). The key result of our analysis is that, given any two brands, there is an asymmetric promotion effect in favor of the higher quality/higher price brands if and only if the quality gap between the brands is sufficiently large in comparison with the price gap. Thus, the direction of promotion asymmetry is not unconditional. It depends uniquely on the value of the ratio of quality and price differences compared to a category specific criterion, which we call Φ. If the ratio of quality and price differences is larger than this criterion, the usual asymmetry prevails; if such is not the case, the lower quality/lower price brands promote more effectively. More precisely, our model predicts that cross promotion effects depend on two components of brand positioning in the price/quality quadrant. First, we define a variable termed “positioning advantage” that indicates whether, relative to the standards achieved by another brand, a given brand is underpriced (positive advantage) or overpriced (negative advantage). Promotion effectiveness is increasing in this variable. Second, cross promotion effects between two brands depend on their distance in the price/quality quadrant. This variable impacts promotion effectiveness negatively and symmetrically for any pair of brands. “Positioning advantage” and “brand distance” are orthogonal components of brand positioning, irrespective of the degree of correlation between available price and quality levels in the market. Empirically, we investigate the role of brand positioning in explaining cross promotion effects using panel data from the chilled orange juice and peanut butter categories. We compute the independent positioning variables, “positioning advantage” and “brand distance,” from readily available data on price and quality positioning after obtaining our estimates of Φ. We next measure promotion effectiveness by estimating choice share changes in response to a price discount, using a choice model that does not contain any information about quality/price ratios. Finally, we test the relation between the two positioning variables and the promotion effectiveness measures. The data reveal that in the orange juice category lower quality/lower price brands generally promote more effectively than higher quality/higher price brands. In the peanut butter data the opposite asymmetry holds. In both cases, inter-brand promotion patterns are well explained by the positioning variables. An attractive feature of our model is that, in addition to the direction of promotion asymmetries, it also explains the extent of those asymmetries. A further interesting aspect of this approach is that we go beyond a categorization of brands into price tiers. For instance, lower tier brands in our data may promote more effectively than one national brand but less effectively than another. Consistent with our theoretical predictions, the data presented here seem to confirm that such cases occur because the lower tier brand offers a favorable trade-off of price and quality differences compared with one national brand and a less favorable trade-off compared with the other. The content of this paper is potentially relevant for brand managers or retailers concerned with predicting the impact of their promotions. The paper is of particular interest to marketing scientists who study the performance of store brands versus national brands and may also appeal to those who wish to explore the marketing implications of behavioral decision theory. Finally, our investigation does not reject Blattberg and Wisniewski’s (1989) finding, shared by Allenby and Rossi (1991) and Hardie, Johnson, and Fader (1993), that national brands have a principle advantage in promotion effectiveness. Rather, it formalizes when this principle advantage is overruled by positioning disadvantages of such brands."
/doi/10.1287/mnsc.2016.2466," Companies that source from emerging economies often face supplier responsibility risks , namely, financial and reputational burdens that the companies have to bear when their suppliers’ engagement in noncomplying labor and environmental practices becomes public. To mitigate such risks, companies can invest in screening mechanisms and design incentive schemes in sourcing contracts. Common mitigation instruments include supplier certification, process audits, and contingency payments. The interactions of these instruments are often not well understood. We first note that the effectiveness of any mitigation instrument depends on how it changes the economic trade-offs faced by a supplier in compliance to social and environmental standard, and hence we develop a model that explicitly captures such trade-offs. As a result, our model endogenizes the supplier’s noncompliance probability and connects it with various factors, including the supplier’s intrinsic ethical level that is unobservable to the buyer. We then study the buyer’s optimal contracting problem under different mitigation instruments. We find that although the process audit and contingency payment instruments can directly lower supplier responsibility risk, they, acting alone, are not as effective as the supplier certification instrument in screening suppliers with different ethical levels. Nevertheless, these instruments are all complementary to each other; when used jointly, they make supplier screening more effective and result in lower sourcing cost. These findings provide explanations for some of the observed practices used in industry to mitigate supplier responsibility risks. This paper was accepted by Serguei Netessine, operations management ."
/doi/10.1287/opre.2015.1364," We study a sequential model of Bayesian social learning in networks in which agents have heterogeneous preferences, and neighbors tend to have similar preferences—a phenomenon known as homophily. We find that the density of network connections determines the impact of preference diversity and homophily on learning. When connections are sparse, diverse preferences are harmful to learning, and homophily may lead to substantial improvements. In contrast, in a dense network, preference diversity is beneficial. Intuitively, diverse ties introduce more independence between observations while providing less information individually. Homophilous connections individually carry more useful information, but multiple observations become redundant."
/doi/10.1287/mnsc.1060.0548," This paper analyzes a dynamic mixed duopoly in which a profit-maximizing competitor interacts with a competitor that prices at zero (or marginal cost), with the cumulation of output affecting their relative positions over time. The modeling effort is motivated by interactions between Linux, an open source operating system, and Microsoft’s Windows and consequently emphasizes demand-side learning effects that generate dynamic scale economies (or network externalities). Analytical characterizations of the equilibrium under such conditions are offered, and some comparative static and welfare effects are examined."
/doi/10.1287/deca.2014.0299," One of the standard assumptions in auction theory is that preferences can be represented with quasilinear utility. This assumption is of particular significance in reverse auctions, which are used in procurement. This paper presents an analysis of quasilinear utilities and their implications. Building on observations of scholars in economics and decision sciences, who note that quasilinear preferences may be rare in practice, the paper shows that in the procurement of goods and services, price is often interrelated with costs. When preferences can be represented with convex or concave utilities, the alternatives in which the buyer's surplus is maximized are different from those that maximize social welfare. The result is that reverse auctions may cause a significant loss of social welfare, which is of particular significance for public organizations. The analysis of concave efficient frontiers in the utility space shows that it is possible to determine deals that yield greater social welfare than the winning bids. If the winning seller is willing to share the increase in utility with the buyer who faces a loss, then these alternatives can produce, for both the buyer and the seller, utility values that are higher than the utility values produced by the winning bid."
/doi/10.1287/mksc.1080.0446," The strategy Philip Morris adopted in 1993 featured a one-time, permanent, publicly announced price cut, an event referred to as Marlboro Friday. Little is known about the impact of permanent and publicly announced price cuts on consumer brand switching behaviors for an addictive product. In the context of Marlboro Friday, we investigate (1) how consumers' brand choices are affected by a permanent price cut, (2) whether differential and dynamic effects of permanent price cuts occur for different types of consumers, and (3) the implications of publicly announced permanent price cuts on consumer brand switching behavior in the long run. We develop a dynamic structural brand choice model that allows for consumer forward-looking behavior, learning, and addiction, and investigate how consumers adjusted their brand choice behaviors before and after this permanent price cut. Using unique consumer panel data pertaining to cigarette purchases before and after the event, we provide behavioral explanations of whether and how the drastic and permanent price cut represented an effective step to encourage brand switching for an addictive product and a necessary step for Philip Morris to combat the growing market share of generic brands."
/doi/10.1287/orsc.2020.1395," While there is a growing literature on moral markets that aim to create social value through market exchange, much of it has focused on how producer activism is able to legitimate new, institutionally complex, organizational and economic forms that are inscribed with competing market and social/community logics. Much less attention has been directed towards understanding how moral markets are scaled by the entry of large, established organizations. While the scaling of moral markets entails the risk of conservative goal transformation, we still know relatively little about how moral values become embedded in markets, providing an ongoing catalyst for social value creation. Based on a five-year ethnographic study, we show how cultural entrepreneurship associated with the creation of a cross-sector partnership, legitimated local food procurement by large, established organizations, enabling the scaling of the overall market. We argue that a key aspect of their success had to do with bridging the institutional void segregating local and industrial food logics. Based on our study, we highlight how this institutional void bridging was facilitated by cultural entrepreneurship that initially focused on communications that decoupled the values and practices associated with the local food logic, and subsequently, reinfused locavore values by valorizing stories and activities that recoupled those values to food procurement practices after the institutional void was diminished. We discuss the implications of our study for research on moral markets and cultural entrepreneurship."
/doi/10.1287/mnsc.1110.1447," Geographic variation in consumer use of Internet retailers is partly explained by variation in offline shopping costs. Explanations for geographic variation in the efficacy of different customer acquisition methods including traditional methods of offline word-of-mouth (WOM) and magazine advertising and information systems (IS)-enabled methods of online WOM and online search remain unexplored. We estimate a multivariate negative binomial distribution (NBD) model on zip code–level customer counts from a leading Internet retailer and provide new insights into factors explaining geographic variation in the success of these methods. First, we show that target customer density explains geographic variation over and above the impact due to the number of potential customers. Moreover, the effect of density is greatest for offline and online WOM acquisitions; this suggests that density contributes to contagion, connectivity, and a hypothesized “social multiplier.” Second, when senders and recipients of WOM share consumption benefits, WOM is more powerful and compelling. We find that location-based convenience benefits have stronger effects on location-dependent offline WOM acquisitions than on location-independent online WOM acquisitions. Third, acquisition channels contribute differently to the total customer pool—offline WOM acquisitions are clustered, whereas magazine acquisitions are dispersed. Finally, separate click-to-conversion data from Coremetrics.com indicates that using the model-based predictions to target specific markets delivers a twofold improvement in actual click-to-order rates. This paper was accepted by Sandra Slaughter, information systems."
/doi/10.1287/mnsc.1060.0615," We develop a model of consumer learning and choice behavior in response to uncertain service in the marketplace. Learning could be asymmetric, that is, consumers may associate different weights with positive and negative experiences. Under this consumer model, we characterize the steady-state distribution of demand for retailers given that each retailer holds a constant in-stock service level. We then consider a noncooperative game in steady state between two retailers competing on the basis of their service levels. The demand distributions of retailers in this game are modeled using a multiplicative aggregate market-share model in which the mean demands are obtained from the steady-state results for individual purchases, but the model is simplified in other respects for tractability. Our model yields a unique pure strategy Nash equilibrium. We show that asymmetry in consumer learning has a significant impact on the optimal service levels, market shares, and profits of the retailers. When retailers have different costs, it also determines the extent of competitive advantage enjoyed by the lower-cost retailer."
/doi/10.1287/mnsc.48.4.517.209," Merger and acquisition activity has increased sharply in the last decade. It seems useful to have models that can help senior managers of bidder firms make informed decisions about the amount of premium, over the target's share prices prevailing prior to merger announcement, that can be justified on the basis of operational synergies . The goal of this article is to capture important parameters from the production side that have a bearing on the valuation of the target's shares. We show that the production characteristics of both the bidder and the target matter in a significant way. For example, if the bidder and target operate in independent markets, the bidder has flexible production facilities but the target's production facilities are inflexible, then an increase in the bidder's demand can make the target less attractive and lower the value of operational synergy."
/doi/10.1287/isre.2017.0764," Consumer ratings play a decisive role in purchases by online shoppers. Although the effects of the average and the number of consumer ratings on future product pricing and demand have been studied with some conclusive results, the effects of the variance of these ratings are less well understood. We develop a model where we decompose the variance of consumer ratings into two sources: taste differences about search and experience attributes of a durable good, and quality differences among instances of this good in the form of product failure. We find that (i) optimal price increases and demand decreases in variance caused by taste differences, (ii) optimal price and demand decrease in variance caused by quality differences, and (iii) when holding the average rating as well as the total variance constant, for products with low total variance, both price and demand increase in the relative share of variance caused by taste differences. Counter to intuition, we demonstrate that risk-averse consumers may prefer a higher-priced product with a higher variance in ratings when deciding between two similar products with the same average rating."
/doi/10.1287/isre.9.4.380," The pervasiveness of software piracy throughout the world is having a profound effect on the software publishing industry and the development of digital intellectual properties and technologies—especially in developing countries, where the piracy rates are extremely high. An economic model is first presented that incorporates the incentive structures for governments, software publishers, and individual consumers. The analytical model provides the economic rationale for the reluctance of a number of governments to aggressively enact and enforce intellectual property rights. An important proposition derived from the analysis states that the government's incentive to enact and enforce copyright laws are closely related to the size of the domestic software industry . The ensuing empirical study provides support for the proposition and further suggests that this relationship holds regardless of the income levels of the countries. Our analysis reveals that alliances between foreign and domestic software publishers through product relationships can be mutually beneficial and will provide an environment of increased copyright enforcement. These results provide a viable strategy to combat global software piracy. With strong policies on copyright enforcement, and a vigorous promotion of alliances between foreign and domestic publishers, a government can increase the net welfare of the country and help establish a strong domestic software industry. Through product relationships with domestic publishers, a foreign publisher can improve profits and operate in an environment of increased intellectual property protection. We then present a general model of ethical behavior related to the impact of behavioral and cultural factors on software piracy. The purpose of this model is to examine whether these determinants of piracy behavior are supranational and transcend cultural and ethical barriers. An empirical study involving U.S. and Indian graduate students suggests that the general model of ethics as related to software piracy is valid in the United States. However, the model results from the Indian sample suggest that additional cross-cultural research with revised models and improved scales is necessary."
/doi/10.1287/mnsc.2015.2160," We consider a monopolistic firm selling two substitutable products to a stream of sequential arrivals whose purchase decisions can be influenced by earlier purchases. Before demand realizes, the firm faces a newsvendor problem for the two products with economies of scale in production for each. When consumers are responsive to others’ decisions, social influence amplifies demand uncertainty, leading to a lower profit for the firm. We propose three solutions for the firm to better cope with or even benefit from social influence: influencer recruitment and a reduced product assortment either before demand realization (ex ante) or under production postponement (ex post). First, the firm can offer promotional incentives to recruit consumers as influencers. We reveal an operational benefit of influencer marketing that a very small fraction of such influencers is sufficient to diminish sales’ unpredictability. Second, as the potential substitutability between products increases due to social influence, the firm may leverage the increased substitutability and enjoy lower cost in production by reducing product assortment before demand realization. Last, under production postponement, the firm can take advantage of the way that social influence results in demand herding and reduce product varieties by reacting to preorder information. This paper was accepted by Martin Lariviere, operations management."
/doi/10.1287/mksc.2017.1046," A key conundrum facing organizations is how to adjust marketing budgets in response to the business cycle. While most firms use procyclical spending (spending less during economic contractions), academic studies often recommend countercyclical spending (spending more during contractions), which begs the following question: What is the right thing to do? The spending problem is compounded further when demand is not just driven by one country’s business cycle, but by the (nonsynchronized) business cycles of multiple countries, as is the case for tourism marketing aiming to attract tourists originating from different countries. We derive insights into the best way to allocate marketing budgets across countries under varying economic conditions. We show that the allocation decisions are driven by the procyclical versus countercyclical nature of three factors: unit sales, marketing effectiveness, and per-unit profit contribution. To study how unit sales and marketing effectiveness respond to the business cycle, we develop a transfer function dynamic hierarchical linear model. We also model the responsiveness of the profit contribution to the business cycle. In an application to New Zealand tourism marketing, we find that a reallocation of the government’s marketing budget could yield an increase in tourist revenues of NZD $121 million. Data and the online appendix are available at https://doi.org/10.1287/mksc.2017.1046 ."
/doi/10.1287/mnsc.46.8.1137.12028," It is standard practice to form predictions from multinomial logit models by ignoring the estimation error associated with the parameter estimates and solving for the predicted endogeneous variable (market share) in terms of the exogenous variables and the point estimates of the parameters. It has long been recognized in the econometrics literature that this type of nonstochastic prediction, which ignores the sampling distribution of the parameter estimates, leads to incorrect inferences about the endogenous variable. We offer a simulationbased approach for approximating the exact stochastic prediction. We show that this approach provides very accurate approximations with minimal computation time and would be easy to implement in industrial applications."
