link,abstract
/doi/10.1287/isre.1120.0451," This paper considers on-demand services and its impact on market structure, firm profitability, and consumer welfare. The unique properties of on-demand services are the conversion of fixed costs to variable costs, removal of capacity constraint, and fast setup time (which enables quick entry by any firm at any time when there is opportunity), whereas privacy and security concerns and switching costs have been noted as the biggest barriers from adopting on-demand services. With a stylized model capturing these benefits and barriers to using on-demand services, we establish several results. First, we show that conversion of fixed cost to variable cost enables new and small firms to enter existing markets and leads to the creation of new markets. Second, we show that competition and the threat of new entrants can be an important driver of a firm's decision to switch to on-demand services. In addition, a firm's barriers to using on-demand services can influence another firm's entry decision. Third, we show that two identical firms may employ different technologies in equilibrium. Fourth, we show that fast setup time and removal of capacity constraint associated with on-demand services make it impossible for firms to make supranormal return and would lead to a perfect competitive market, even when there is only one firm, under very general conditions. Such a result still holds even when there exists an economy of scale (e.g., quantity discount) from using on-demand services. On the other hand, when there are barriers preventing firms from offering similar products and products are substantially differentiated, on-demand services can amplify this advantage of entry barriers by enabling firms to further increase prices and enhance their profitability. Therefore, contrary to the common belief that offering on-demand services is best for firms offering commodity products, we show on-demand services to be more profitable for firms with differentiated products."
/doi/10.1287/mnsc.2021.4063," Driving is an integral component of many operational systems, and any small improvement in driving quality can have a significant effect on accidents, traffic, pollution, and the economy in general. However, making improvements is challenging given the complexity and multidimensionality of driving as a task. In this paper, we investigate the effectiveness of nudging to improve driving performance. In particular, we leverage a smartphone application launched by our industry partners to send three types of nudges through notifications to drivers, indicating how they performed on the current trip with respect to their personal best, personal average, and latest driving performance. We measure the resulting driving performance using telematics technology (i.e., real-time sensor data from an accelerometer, Global Positioning System (GPS), and gyroscope in a mobile device). Compared with the “no-nudge” control group, we find that personal best and personal average nudges improve driving performance by approximately 18% standard deviations of the performance scores calculated by the application. In addition, these nudges improve interaccident times (by nearly 1.8 years) and driving performance consistency, as measured by the standard deviation of the performance score. Noting that driving abilities and feedback seeking may vary across individuals, we adopt a generalized random forest approach, which shows that high-performing drivers who are not frequent feedback seekers benefit the most from personal best nudges, whereas low-performing drivers who are also frequent feedback seekers benefit the most from the personal average nudges. Finally, we investigate the potential mechanism behind the results by conducting an online experiment in a nondriving context. The experiment shows that the performance improvements are directly driven by the changes in participants’ effort in response to different nudges and that our key findings are robust in alternative (nondriving) settings. Our analysis further shows that nudges are effective when the variability in reference points is low, which explains why the personal best and personal average nudges are effective, whereas the last score nudge is not. This paper was accepted by Vishal Gaur, operations management."
/doi/10.1287/mnsc.1070.0741," Performance-based contracting is reshaping service support supply chains in capital-intensive industries such as aerospace and defense. Known as “power by the hour” in the private sector and as “performance-based logistics” (PBL) in defense contracting, it aims to replace traditionally used fixed-price and cost-plus contracts to improve product availability and reduce the cost of ownership by tying a supplier's compensation to the output value of the product generated by the customer (buyer). To analyze implications of performance-based relationships, we introduce a multitask principal-agent model to support resource allocation and use it to analyze commonly observed contracts. In our model the customer (principal) faces a product availability requirement for the “uptime” of the end product. The customer then offers contracts contingent on availability to n suppliers (agents) of the key subsystems used in the product, who in turn exert cost reduction efforts and set spare-parts inventory investment levels. We show that the first-best solution can be achieved if channel members are risk neutral. When channel members are risk averse, we find that the second-best contract combines a fixed payment, a cost-sharing incentive, and a performance incentive. Furthermore, we study how these contracts evolve over the product deployment life cycle as uncertainty in support cost changes. Finally, we illustrate the application of our model to a problem based on aircraft maintenance data and show how the allocation of performance requirements and contractual terms change under various environmental assumptions."
/doi/10.1287/trsc.2016.0706," We propose routing algorithms for plug-in hybrid electric vehicles (PHEVs) that account for the significant energy efficiency differences of vehicle operating modes and recommend the predominant mode of operation for each road segment during route planning. This is to enhance fuel economy and reduce emissions. We introduce the energy-efficient routing problem (EERP) for PHEVs and formulate this problem as a new class of the shortest path problem. The objective of the EERP is to not only find a path to any given destination but also to identify the predominant operating mode for each segment of the path to minimize fuel consumption. EERP can be generalized to a new class of problems in the context of network optimization, where for each arc we need to choose which resources to use to minimize the consumption of one of the resources subject to a constraint on the other resource. In this problem, the resource selection is mutually exclusive, which means we cannot choose both resources together for an arc. We prove that the EERP is NP-complete. We then propose two exact algorithms, and a fully polynomial time approximation scheme (FPTAS) to solve the EERP. We demonstrate the performance of our proposed exact and FPTAS algorithms using road network data from Southeast Michigan. The results show that incorporating our proposed algorithms during route planning leads to significant energy savings for PHEVs over simplistic routing algorithms and current practice."
/doi/10.1287/inte.7.4.56," —“Assessment of energy R&D programs for the Appalachian region”; —“From Mexico: A wheat distribution model”; —“Management science model used in Bell system corporate planning”; —“News: Gravitational models in product distribution”; —“News: Ship combat system”; —“News: Medical treatment and evacuation”; —“News: Police patrol operations”; —“News: Pricing of products in the solar array manufacturing industry”; —“Seen Elsewhere” with five overviews: (1) A Rachet Model of Advertising Carryover Effects ( Journal of Marketing , February 1976, Vol. 13, No. 3, pp. 76–79) by Leonard J. Parsons (Claremont Graduate School); (2) Image inputs to a Probabilistic Model: Predicting Retail Potential ( Journal of Marketing , July 1976, Vol. 40, No. 3, pp. 48–53) by Thomas J. Stanley and Murphy A. Sewall (State University of New York at Albany), (3) The State of Practice in Planning Systems ( Sloan Management Review , Winter 1977, Vol. 18, No. 2, pp. 1–24) by H. Igor Ansoff (Vanderbilt University), (4) Production Performance and Customer Satisfaction: A New Concept ( Journal of Marketing April 1976, Vol. 40, No. 2, pp. 11–16) by John E. Swan and Linda Jones Combs (University of Arkansas), (5) Articles from SIMSNIPS, February 1977 and May 1977: A Study of Buffer Management Policies for Data Management Systems, Simulating a Virtual Data Machine, Honeywell Time-Sharing System, Dynamics of a Crash Victim, Patient Admission as a Markov Decision Process, Gasoline-Consumption Model, Simulation of Alternate Pediatric Hospital Care Units, Volume III, Air Defense System, Dayton Aircraft Cabin Fire Model, Reference Scene, Growth, Water Planning, Wheat Yield, Undersea Oil Sites, Computer Workload, Airport Parking, Driver-Vehicle Behavior at an Intersection, Hotel Management, Fire Station Location."
/doi/10.1287/mnsc.2020.3754," This paper develops a theory of financing of entrepreneurial ventures via crypto tokens, which is not limited to platform-based ventures. We compare token financing with traditional equity financing, focusing on agency problems and information asymmetry frictions associated with the two financing methods, as well as on risk sharing between entrepreneurs and investors. Token financing introduces an agency problem not present under equity financing (underproduction), while mitigating an agency problem often associated with equity financing (entrepreneurial effort underprovision). Our theory abstracts from all institutional and potentially transient differences between tokens and equity and is based on a single intrinsic characteristic of tokens: they represent claims to a venture’s output. We show that tokens are likely to dominate equity for ventures developing goods or services that involve low marginal production costs, those for which entrepreneurial effort is crucial, and/or those with relatively low payoff volatility. In addition, tokens can have an advantage over equity in signaling venture quality to outside investors. This paper was accepted by Kay Giesecke, finance."
/doi/10.1287/moor.2020.1095," Consider a dominance relation (a preorder) ≿ on a topological space X , such as the greater than or equal to relation on a function space or a stochastic dominance relation on a space of probability measures. Given a compact set K ⊆ X , we study when a continuous real function on K that is strictly monotonic with respect to ≿ can be extended to X without violating the continuity and monotonicity conditions. We show that such extensions exist for translation invariant dominance relations on a large class of topological vector spaces. Translation invariance or a vector structure are no longer needed when X is locally compact and second countable. In decision theoretic exercises, our extension theorems help construct monotonic utility functions on the universal space X starting from compact subsets. To illustrate, we prove several representation theorems for revealed or exogenously given preferences that are monotonic with respect to a dominance relation."
/doi/10.1287/orsc.1100.0584," The notion that firms can improve their innovativeness by tapping users and customers for knowledge has become prominent in innovation studies. Similar arguments have been made in the marketing literature. We argue that neither literatures take sufficient account of firm organization. Specifically, firms that attempt to leverage user and customer knowledge in the context of innovation must design an internal organization appropriate to support it. This can be achieved in particular through the use of new organizational practices, notably, intensive vertical and lateral communication, rewarding employees for sharing and acquiring knowledge, and high levels of delegation of decision rights. In this paper, six hypotheses were developed and tested on a data set of 169 Danish firms drawn from a 2001 survey of the 1,000 largest firms in Denmark. A key result is that the link from customer knowledge to innovation is completely mediated by organizational practices. This work is licensed under a Creative Commons Attribution 4.0 International License. You are free to copy, distribute, transmit and adapt this work, but you must attribute this work  as “ Organization Science . Copyright © 2017 INFORMS. https://doi.org/10.1287/orsc.1100.0584 , used under a  Creative Commons Attribution License: http://creativecommons.org/licenses/by/4.0/ .”"
/doi/10.1287/trsc.2021.1050," We study cooperation among hinterland container transport operators that may share transport capacity and demand in corridors between inland and sea ports. We model this transportation problem as a minimum cost flow problem and assume that operators share the total cost based on a bargaining outcome, which has been proven equivalent to the Shapley value. To examine the stability of such cooperation, we perform a sensitivity analysis of the membership of the Shapley value (the bargaining outcome) to the core (the set of stable outcomes) by leveraging a novel concept of parametric cooperative games. We obtain closed-form solutions for identical players that explicitly characterize the impact of overcapacity on the stability of cooperation. For more general cases, we develop a computational approach based on parametric optimization techniques. The numerical results indicate that our primary analytical result, that is, that overcapacity undermines stability, is generally valid, and that overcapacitated networks may permit stable cooperation in only a limited range of settings."
/doi/10.1287/mnsc.13.2.B52," Past treatment of the single machine maintenance problem has shown that preventive maintenance may be desirable for equipment for which failures are caused at least partially by wear-out factors. In all previous treatment, however, the size of the maintenance-repair crew has been held constant and the optimal maintenance period has then been determined. This paper develops a simultaneous solution for the maintenance-repair crew size and the optimal maintenance period. The optimal maintenance period is seen to shift as the size of the maintenance-repair crew varies. For the multi-machine maintenance problem, the sharing of the maintenance-repair crew creates a queuing system. Because of its complexity, an analytical solution of this multi-machine maintenance queuing system is not feasible. A simulation model was used to develop a set of general rules for scheduling maintenance for the multi-machine case."
/doi/10.1287/mnsc.2019.3471," How does market competition affect pay inequality between and within firms? Using division managers as a pool of similar workers and the Canada–U.S. Free Trade Agreement, we find that greater competition increases overall pay inequality between, but not within, firms. This null effect within firms is not driven by a lack of statistical power. Instead, we find that it arises primarily within subsamples of firms with higher predicted levels of social comparison. Increased competition leads to greater pay-performance sensitivity among the higher-paid managers within firms, while it leads to greater overpayment among the other managers. These patterns are consistent with firm principals offering higher-powered incentives to their best managers and overpaying the rest. Altogether, this study suggests that, while competition leads to greater pay inequality overall, principals aim to maintain equality within firms and do so through the differential provision of incentives among employees. This paper was accepted by Bruno Cassiman, business strategy ."
/doi/10.1287/deca.2018.0383," Authentication is a major component in protecting the security of online user services. An effective implementation of security policies requires compliance from users, who are one class of key stakeholders in the cybersecurity policy decision problem. We examine this multiple stakeholder decision problem by conducting a virtual public values forum, a policy decision structuring methodology to characterize stakeholder values by eliciting essential trade‐offs among conflicting objectives. We assess trade‐offs for a sample of users to explore heterogeneity in user values and the relationship of trade‐offs to both individual user characteristics and online context. We obtained responses from 265 online service users and elicited their trade‐offs among three conflicting objectives related to authentication security: (1) maximizing security, (2) maximizing convenience, and (3) minimizing cost. Using an additive multiattribute value model with four attributes, we obtained scaling coefficients that denote the relative valuation of each attribute to the decision maker and discovered that for the attribute ranges considered, security followed by cost receive the highest priority; however, there is a group of respondents who consider convenience to have higher valuation than either cost or security. We also explore the relationships between user characteristics (self-efficacy, response efficacy, response cost, and perceived severity) and the calculated scaling coefficients."
/doi/10.1287/mnsc.1100.1214," This paper develops an economic theory of the costs and benefits of corporate culture—in the sense of shared beliefs and values—in order to study the effects of “culture clash” in mergers and acquisitions. I first use a simple analytical framework to show that shared beliefs lead to more delegation, less monitoring, higher utility (or satisfaction), higher execution effort (or motivation), faster coordination, less influence activities, and more communication, but also to less experimentation and less information collection. When two firms that are each internally homogeneous but different from each other merge, the above results translate to specific predictions about how the change in homogeneity will affect firm behavior. This paper's predictions can also serve more in general as a test for the theory of culture as shared beliefs."
/doi/10.1287/mnsc.2017.2865," We analyze the optimal execution problem of a portfolio manager trading multiple assets. In addition to the liquidity and risk of each individual asset, we consider cross asset interactions in these two dimensions, which substantially enriches the nature of the problem. Focusing on the market microstructure, we develop a tractable order book model to capture liquidity supply/demand dynamics in a multiasset setting, which allows us to formulate and solve the optimal portfolio execution problem. We find that cross asset risk and liquidity considerations are of critical importance in constructing the optimal execution policy. We show that even when the goal is to trade a single asset, its optimal execution may involve transitory trades in other assets. In general, optimally managing the risk of the portfolio during the execution process affects the time synchronization of trading in different assets. Moreover, links in the liquidity across assets lead to complex patterns in the optimal execution policy. In particular, we highlight cases where aggregate costs can be reduced by temporarily “overshooting” one’s target portfolio. This paper was accepted by Jerome Detemple, finance."
/doi/10.1287/mnsc.49.2.160.12742," This paper evaluates the relative performances of several well–known and widely–used incentive mechanisms under controlled experimental conditions. The scenario utilized is a delegated investment setting where effort and risk aversions contribute to moral hazard among fund managers. Analytical intractability of the problem requires a computational modeling approach to simulate comparative solutions for specific contracts under different parametric settings. Through a simulation exercise, we consider multiple agents who decide their investment strategy over several consecutive periods. Agents learn about estimation and market uncertainty through repeated realizations of investment returns. In each sequence of periods, a number of different incentive mechanisms based on the agent's communication and/or outcome are considered. Results of the computational experiments are presented. Our results overwhelmingly show the efficacy of the incentive contracts in improving the welfare of the investors. In the presence of an estimation risk, when agents learn from their past performances, the market volatility interacts with the estimation risk that makes risk–sharing arrangements such as limited liability overly important. Paying the agent to assume the risk may no longer lead to the best performance incentives."
/doi/10.1287/mnsc.2018.3274," We offer the first empirical analysis connecting the timing of general partner (GP) compensation to private equity fund performance. Using detailed information on limited partnership agreements between private equity limited and general partners, we find that “GP-friendly” contracts—agreements that pay general partners on a deal-by-deal basis instead of withholding carried interest until a benchmark return has been earned—are associated with higher returns, both gross and net of fees. This is robust to measures of performance persistence, time period effects, and other contract terms and is related to exit-timing incentives. Timing practices balance GP incentives against limited partner downside protection. This paper was accepted by Gustavo Manso, finance."
/doi/10.1287/msom.3.2.151.9989," This paper models a type of vendor-managed inventory (VMI) agreement that occurs in practice called a (z, Z) contract. We investigate the savings due to better coordination of production and delivery facilitated by such an agreement. The optimal behavior of both the supplier and the retailer are characterized. The optimal replenishment and production policies for a supplier are found to be up-to policies, which are shown to be easily computed by decoupling the periods when the supplier outsources from those when the supplier does not outsource. A simple application of the newsvendor relation is used to define the retailer's optimal policy. Numerical analysis is conducted to compare the performance of a single supplier and a single retailer operating under a (z, Z) VMI contract with the performance of those operating under traditional retailer-managed inventory (RMI) with information sharing. Our results verify some observations made in industry about VMI and show that the (z, Z) type of VMI agreement performs significantly better than RMI in many settings, but can perform worse in others."
/doi/10.1287/mksc.2019.1183," Sports franchises derive significant portions of their revenues from season ticket holders. A development that may affect season ticket management is the growth of legal secondary markets. We develop a structural model that integrates both the supply and demand sides of the secondary market into season ticket buyers’ ticket purchase and usage choices. We use a panel data set that combines season and single ticket purchase records with ticket usage data to investigate the value of secondary markets. We estimate that the secondary market increases the team’s season ticket revenues by about $1 million per season. At the level of the individual season ticket customer, we estimate an increase in customer lifetime value ranging from $1,327 in the lowest quality seat tier to $2,553 in the highest. In terms of value to the customer, the average dollar value of having a secondary market is $138 per season ticket. Across segments, the secondary market provides the equivalent of a 4% discount in the premium seat tier versus an 11% discount in the economy seat tier. Whereas the secondary market creates more value in the premium-ticket tier segments, the secondary market has the most impact on behavior in the low price oriented segment."
/doi/10.1287/mnsc.2021.4088," We argue that extrapolative expectations drive boom–bust cycles in the postwar art market. Price run-ups coincide with increases in demand fundamentals but are followed by predictable busts. Predictable changes account for about half of the variance of five-year price changes. High prices coincide with many attributes of speculative bubbles: trading volume, the share of short-term trades, the share of postwar art, and volatility are all higher during booms. In addition, short-term transactions underperform long-term transactions. Survey evidence further confirms the link between beliefs, prices, and volume dynamics as in models in which extrapolative beliefs fuel speculative bubbles. This paper was accepted by Tyler Shumway, finance."
