link,abstract
/doi/10.1287/mnsc.41.3.401," Electronic Data Interchange (EDI) is an emerging type of standardized inter-organizational information system. We analyze the impact of EDI on the upstream suppliers’ competitive position in a simple two-level hierarchical market structure where the buyer faces a linear demand curve and the competing heterogeneous suppliers have an upward-sloping marginal cost function. We show that a suppliers’ adoption of EDI can generate positive externalities for the buyer and negative (or competitive) externalities for other suppliers. As a result, the buyer provides a price premium to those suppliers who adopt EDI and increases their sales volume and market share. Moreover, when the benefits that the buyer can derive from implementing EDI are substantial, and the suppliers’ EDI adoption costs are high, it may be in the buyer’s best interest to subsidize the suppliers so as to encourage them to adopt EDI, instead of mandating them to do so. Regardless of whether the buyer employs a mandatory or a subsidizing policy, the buyer and the end consumers may be the only ones who gain from this new technology. Consequently, a partial adoption by the supplier base may be optimal for the buyer when the suppliers’ adoption costs are sufficiently high. We also show that, while EDI reduces the transaction costs of the buyer, the upstream market tends to become more concentrated as a result of increased cost differentials. These results provide one economic explanation of the fact that many companies have actually reduced their supplier base after implementing EDI, despite a significant reduction in their market transaction costs."
/doi/10.1287/orsc.2014.0959," Although many recent studies have emphasized the multiplicity of institutional logics and the competition among them, how some institutional logics become prioritized over others in shaping organizational decisions is undertheorized. Drawing on panel data of 118 industrial facilities across 34 communities in Texas and Louisiana, we show that the saliency of different kinds of community logics significantly affects environmental practices—specifically, toxic waste emissions—of facilities in a community. Our results show that community logics not only have direct effects but also have indirect effects by filtering organizational reactions to broader field-level institutional logics. We theorize how community logics can amplify or dampen the influence of broader field-level logics and discuss the implications for the study of institutional complexity, social movements, and values in the configuration of institutional logics."
/doi/10.1287/mksc.2017.1042," With the cooperation of a large mobile service provider, we conduct a novel field experiment that simultaneously randomizes the prices of two competing movie theaters using mobile coupons. Unlike studies that vary only one firm’s prices, our experiment allows us to account for competitor response. We test mobile targeting based on consumers’ real-time and historic locations, allowing us to evaluate popular mobile coupon strategies in a competitive market. The experiment reveals substantial profit gains from mobile discounts during an off-peak period. Both firms could create incremental profits by targeting their competitor’s location. However, the returns to such “geoconquesting” are reduced when the competitor also launches its own targeting campaign. We combine our experimentally generated data with a demand model to analyze optimal pricing in a static Bertrand–Nash equilibrium. Interestingly, competitive responses raise the profitability of behavioral targeting where symmetric pricing incentives soften price competition. By contrast, competitive responses lower the profitability of geographic targeting, where asymmetric pricing incentives toughen price competition. If we endogenize targeting choice, both firms would choose behavioral targeting in equilibrium, even though more granular geobehavioral targeting combining both real-time and historic locations is possible. These findings demonstrate the importance of considering competitor response when piloting novel price-targeting mechanisms. Data are available at https://doi.org/10.1287/mksc.2017.1042 ."
/doi/10.1287/mnsc.2014.1957," We show that the cost of employee turnover in firms that rely on decentralized knowledge and personal relationships depends on the firms' planning horizons and the departing employees' incentives to transfer information. Using exogenous shocks to the relationship between borrowers and loan officers, we document that borrowers whose loan officers are on leave are less likely to receive new loans from the bank, are more likely to apply for credit from other banks, and are more likely to miss payments or go into default. These costs are smaller when turnover is expected, as in the case of maternity leave, or when loan officers have incentives to transfer information, as in the case of voluntary resignations. This paper was accepted by Wei Jiang, finance ."
/doi/10.1287/mnsc.2018.3142," What motivates the rich and powerful to exhibit generosity? We explore this important question in a large field experiment. We solicit donations from 32,174 alumni of an Ivy League university, including thousands of rich and powerful alumni. Consistent with past psychology research, we find that the rich and powerful respond dramatically, and differently than others, to being given a sense of agency over the use of donated funds. Gifts from rich and powerful alumni increase by 100%–350% when they are given a sense of agency. This response arises primarily on the intensive margin with no effect on the likelihood of donating. Results suggest that motivating the rich and powerful to act may require tailored interventions. This paper was accepted by Uri Gneezy, behavioral economics."
/doi/10.1287/mksc.2014.0867," In this paper, we untangle the searchable and experiential dimensions of quality responses to entry by counterfeiters in emerging markets with weak intellectual property rights. Our theoretical framework analyzes market equilibria under competition from counterfeiting as well as under monopoly branding. A key theoretical prediction is that emerging markets can be self-corrective with respect to counterfeiting issues in the following sense: First, counterfeiters can earn positive profits by pooling with authentic brands only when consumers have good faith in the market (i.e., they believe there is low probability that any product is a counterfeit). When the proportion of counterfeits in the market exceeds a cutoff value, brands invest in self-differentiation from the competitive-fringe counterfeiters. Second, to attain a separating equilibrium with counterfeiters, branded incumbents upgrade the searchable quality (e.g., appearance) of their products more and improve the experiential quality (e.g., functionality) less compared with monopoly equilibrium. However, in the pooling equilibrium with sporadic counterfeits, authentic firms instead may invest in experiential quality to attract more of the expert consumers who are well versed in quality. This prediction uncovers the nature of product differentiation in the searchable dimension and helps with analyzing real-world innovation strategies employed by authentic firms in response to entries by counterfeit entities. In addition, welfare analysis hints at a nonlinear relationship between social welfare and intellectual property enforcement."
/doi/10.1287/mnsc.2014.2110," This paper investigates how venture-backed companies are affected when others sharing the same investor suffer a negative shock. In theory, companies may be helped or hurt in this scenario. To examine the topic empirically, I estimate the impact of the collapse of the technology bubble on non-information-technology (non-IT) companies that were held alongside IInternet companies in venture portfolios. Using a difference-in-differences framework, I find that the end of the bubble was associated with a significantly larger decline in the probability of raising continuation financing for these non-IT companies in comparison to others. This does not appear to be driven by unobservable company characteristics such as company quality or IT relatedness; for the same portfolio company receiving capital from multiple venture firms, investors with greater Internet exposure were significantly less likely to continue to participate in follow-on rounds. This paper was accepted by Itay Goldstein, operations management."
/doi/10.1287/mnsc.2016.2499," We study the effects of reminders on people’s behavior in investment activities characterized by up-front costs and delayed benefits, such as getting an education and maintaining a healthy lifestyle. We conduct a field experiment and show that simple weekly reminders induce users of a gym to substantially increase their gym attendance over an extensive period. Users’ response to reminders is immediate (within hours) and recurrent for any subsequent reminder, which can be explained by limited attention. We find some evidence of habit formation, leading to more frequent physical activity also after treatment, although with an effect smaller than during treatment. Simple reminders are thus a cost-effective policy tool. Data are available at http://dx.doi.org/10.1287/mnsc.2016.2499 . This paper was accepted by Uri Gneezy, behavioral economics ."
/doi/10.1287/inte.28.4.64, The stochastic tree is a recently introduced generalization of the decision tree which allows the explicit depiction of temporal uncertainty while still employing the familiar rollback procedure for decision trees. We offer an introduction to stochastic-tree modeling and techniques involved in their application to medical-treatment decisions. We also describe an application of these tools to the analysis of the decision to undergo a total hip replacement from the perspectives of an individual patient (via utility analysis) and of society (via cost-effectiveness analysis).
/doi/10.1287/orsc.11.2.148.12508," Many employees in the world are evaluated and rewarded at work based on who they are (“particularism”) rather than based on impersonal judgments of their performance (“universalis”). Yet the field of organizational behavior has been virtually silent on how employees react to workplaces dominated by particularism. In an effort to understand the role of particularistic organizational practices, several ideas from comparative institutions theories are applied to questions of organizational behavior, and the model is tested in samples of large manufacturing and service organizations in the United States and Hungary. It was found that employees in a modernist political system (United States) did echo social scientists’ claims by reporting that their employers’ personnel practices were comparatively more universalistic than those in organizations operating in a neotraditional polity (Hungary). This perception of differences in personnel practices mediated the relationship between political system and employees’ trust in one another, their perceptions of coworker shirking, and their organizational commitment."
/doi/10.1287/orsc.2020.1403," We connect two distinct streams of research on categories to study the role of within-category typicality in the context of legitimacy shocks. We argue that, following a legitimacy shock, member organizations of the tainted, focal category suffer equally, irrespective of their typicality. However, only the typical members of the newly favored, oppositional category benefit. Therefore, the effects of legitimacy shocks are asymmetrically influenced by typicality. We argue this pattern is the result of a two-stage process of categorization by audiences, whereby audiences prioritize distinctions between organizations in a newly favored category and spend limited efforts considering distinctions in the tainted, focal category. We examine our theory in the context of the U.S. financial services industry, where four different kinds of organizations engage in competition: traditional commercial banks, community banks, single-bond credit unions, and multibond credit unions. Consistent with our theory, we show that both traditional commercial banks and community banks suffer in terms of deposit market share following the legitimacy shock of the 2007 financial crisis, but the relative gains to credit unions are strongest for single-bond credit unions."
/doi/10.1287/mnsc.2014.2002," Financially constrained borrowers have the incentive to influence the appraisal process in order to increase borrowing or reduce the interest rate. We document that the average valuation bias for residential refinance transactions is above 5%. The bias is larger for highly leveraged transactions, around critical leverage thresholds, and for transactions mediated through a broker. Mortgages with inflated valuations default more often. Lenders account for 60%–90% of the bias through pricing. This paper was accepted by Wei Jiang, finance ."
/doi/10.1287/mnsc.2013.1739," We analyze the implications of the decision to spawn or to retain a new product for the nature and evolution of the firm. In our model, a new product is spawned if the fit between the product and its parent firm organization is not adequate. We focus on the impact of the firm's history of spawning decisions on firm characteristics such as size, focus, profitability, and innovativeness, and analyze its role in shaping firm dynamics. In accordance with the empirical literature, our model predicts that older firms innovate less, spawn less, are more diversified and less profitable, and that firms with more valuable general or specialized resources innovate and spawn more. Echoing seemingly contradictory empirical findings, our model predicts that small, focused firms (large, diversified firms) innovate and spawn more, and are more profitable when sample heterogeneity is driven by the importance of organizational fit (the value of general resources). This paper was accepted by Bruno Cassiman, business strategy."
/doi/10.1287/orsc.2020.1369," Authenticity is a valuable attribution for organizations, but one that raises a challenge of audience acceptance for innovative entrepreneurs. In particular, organizations that depart from an established type risk being judged as inauthentic. However, entrepreneurs may be able to overcome this challenge by basing their authenticity on notions of craft—such as skilled hands-on techniques, sophisticated ingredients, and small-scale artistry rather than mass industrial manufacturing—that better support innovation. We propose that communities vary in the extent to which they embrace craft production as an evolved understanding of authenticity that is less concerned with conformity to type. This local context, in turn, conditions the likelihood of entrepreneurs creating innovative ventures that rely on perceptions of craft authenticity. We develop this argument through a mixed-methods study of the spatially uneven emergence of gourmet food trucks across the United States. Our findings contribute to research on authenticity and the geography of entrepreneurship and innovation."
/doi/10.1287/mnsc.2018.3035," Even though commodity-pricing models have been successful in fitting the term structure of futures prices and its dynamics, they do not generate accurate true distributions of spot prices. This paper develops a new approach to calibrate these models using not only observations of oil futures prices, but also analysts’ forecasts of oil spot prices. We conclude that to obtain reasonable expected spot curves, analysts’ forecasts should be used, either alone or jointly with futures data. The use of both futures and forecasts, instead of using only forecasts, generates expected spot curves that do not differ considerably in the short/medium term, but long term estimations are significantly different. The inclusion of analysts’ forecasts in addition to futures, instead of only futures prices, does not alter significantly the short/medium part of the futures curve but does have a significant effect on long-term futures estimations. This paper was accepted by Gustavo Manso, finance."
/doi/10.1287/opre.1110.1003," We present a methodology for long-term mine planning based on a general capacitated multicommodity network flow formulation. It considers underground and open-pit ore deposits sharing multiple downstream processing plants over a long horizon. The purpose of the model is to optimize several mines in an integrated fashion, but real size instances are hard to solve due to the combinatorial nature of the problem. We tackle this by solving the relaxation of a tight linear formulation, and we round the resulting near-integer solution with a customized procedure. The model has been implemented at Codelco, the largest copper producer in the world. Since 2001, the system has been used on a regular basis and has increased the net present value of the production plan for a single mine by 5%. Moreover, integrating multiple mines provided an additional increase of 3%. The system has allowed planners to evaluate more scenarios. In particular, the model was used to study the option of delaying by four years the conversion of Chiquicamata, Codelco's largest open-pit mine, to underground operations."
/doi/10.1287/mnsc.2020.3837," A person’s success often depends on whether others believe what they say. Growing evidence suggests that people are less likely to believe statements made by women rather than men. We consider whether assertive cheap talk, an important and widely used tool for increasing credibility, is a mechanism for this gender gap. If women face negative returns to assertive cheap talk, then they have less access to an effective tool for increasing their credibility. We provide evidence using a laboratory experiment and an online replication, both with real stakes, in an advice-following setting. We study whether assertive cheap talk affects advice following, whether subjects discriminate based on advisor gender, and whether there are differential returns to assertive cheap talk by gender. Subjects were randomly assigned to an unseen male or female team leader who were otherwise identical and to different types of prescripted, increasingly assertive written communication from the leader. Assertive language significantly increased advice following, but we find no evidence for gender discrimination. We also find that assertive language had positive returns for both male and female leaders, despite subjects perceiving this language as more masculine. However, female subjects were still less likely to choose the self-promotional language. Thus, even in the absence of discrimination, this choice would reduce adherence to advice provided by women, generating a gender gap. Greater use of assertive language could be an effective strategy for women to increase their influence and credibility in the labor market. This paper was accepted by Yan Chen, decision analysis."
/doi/10.1287/mnsc.2015.2308," We explore the impact of geographically bounded, intrafirm linkages (internal agglomerations) and geographically bounded, interfirm linkages (external agglomerations) on firms’ location strategies. Using data from the Census Bureau’s Longitudinal Business Database, we analyze the locations of new establishments of biopharmaceutical firms in the United States from 1993 to 2005. We consider all activities in the value chain and allow location choices to vary by research and development, manufacturing, and sales. Our findings suggest that internal agglomerations have a positive impact on location. The effects of internal agglomerations vary by activity, and they arise both within an activity (e.g., among plants) and across activities (e.g., between sales and manufacturing). Our results also suggest that previous estimates of the effect of external agglomerations may be overestimated because the existing literature abstracted from internal agglomerations. This paper was accepted by Bruno Cassiman, business strategy ."
/doi/10.1287/mksc.2018.1144," Consumers often learn the weights they ascribe to product attributes (“preference weights”) as they search. For example, after test driving cars, a consumer might find that he or she undervalued trunk space and overvalued sunroofs. Preference-weight learning makes optimal search complex because each time a product is searched, updated preference weights affect the expected utility of all products and the value of subsequent optimal search. Product recommendations, which take preference-weight learning into account, help consumers search. We motivate a model in which consumers learn (update) their preference weights. When consumers learn preference weights, it may not be optimal to recommend the product with the highest option value, as in most search models, or the product most likely to be chosen, as in traditional recommendation systems. Recommendations are improved if consumers are encouraged to search products with diverse attribute levels, products that are undervalued, or products for which recommendation-system priors differ from consumers’ priors. Synthetic data experiments demonstrate that proposed recommendation systems outperform benchmark recommendation systems, especially when consumers are novices and when recommendation systems have good priors. We demonstrate empirically that consumers learn preference weights during search, that recommendation systems can predict changes, and that a proposed recommendation system encourages learning. The data files and online appendix are available at https://doi.org/10.1287/mksc.2018.1144 ."
/doi/10.1287/opre.50.5.904.360," Decision making under uncertainty is a challenge faced by many decision makers. Stochastic programming is a major tool developed to deal with optimization with uncertainties which has found applications in, e.g., finance, such as asset–liability and bond–portfolio management. Computationally, however, many models in stochastic programming remain unsolvable because of overwhelming dimensionality. For a model to be well solvable, its special structure must be explored. Most of the solution methods are based on decomposing the data. In this paper we propose a new decomposition approach for two-stage stochastic programming, based on a direct application of the path-following method combined with the homogeneous self-dual technique. Numerical experiments show that our decomposition algorithm is very efficient for solving stochastic programs. In particular, we apply our decomposition method to a two-period portfolio selection problem using options on a stock index. In this model the investor can invest in a money-market account, a stock index, and European options on this index with different maturities. We experiment with our model with market prices of options on the S&P500."
/doi/10.1287/ijoc.1050.0136," Many simulation practitioners can get more from their analyses by using the statistical theory on design of experiments (DOE) developed specifically for exploring computer models. We discuss a toolkit of designs for simulators with limited DOE expertise who want to select a design and an appropriate analysis for their experiments. Furthermore, we provide a research agenda listing problems in the design of simulation experiments—as opposed to real-world experiments—that require more investigation. We consider three types of practical problems: (1) developing a basic understanding of a particular simulation model or system, (2) finding robust decisions or policies as opposed to so-called optimal solutions, and (3) comparing the merits of various decisions or policies. Our discussion emphasizes aspects that are typical for simulation, such as having many more factors than in real-world experiments, and the sequential nature of the data collection. Because the same problem type may be addressed through different design types, we discuss quality attributes of designs, such as the ease of design construction, the flexibility for analysis, and efficiency considerations. Moreover, the selection of the design type depends on the metamodel (response surface) that the analysts tentatively assume; for example, complicated metamodels require more simulation runs. We present several procedures to validate the metamodel estimated from a specific design, and we summarize a case study illustrating several of our major themes. We conclude with a discussion of areas that merit more work to achieve the potential benefits—either via new research or incorporation into standard simulation or statistical packages."
